author,published_at,updated_at,like_count,text
@angushall6377,2025-04-11T10:51:59Z,2025-12-01T20:56:13Z,0,Big biggest Problem  Thomas frank aner slot enzo maresca
@LazarusUnwrapped,2025-04-10T09:20:08Z,2025-04-10T09:20:53Z,1,"They show the best scenes in the trailer. I’m not familiar with the comic character either. I wouldn’t recommend paying for it. Dissapointing and mediocre, with a p*ss-poor dialogue. Some might like it. I was hoping for something a little darker."
@regden6054,2025-04-08T18:31:21Z,2025-04-08T18:31:21Z,1,It was stupid because the girl had a superhuman potion and she gave it to someone she didn&#39;t know what if he was a psychopath stupid plot
@lpmj2619,2025-04-07T13:11:07Z,2025-04-07T13:19:32Z,0,Yoooo! Kraven filled a huge superhero gap. Am I right?🙌🏽
@WengCeruela,2025-04-06T15:10:36Z,2025-04-06T15:10:36Z,3,great movie💗💗💗
@Sonny.exe01,2025-04-06T02:20:31Z,2025-04-06T02:20:31Z,0,Movie name
@fit.sunilj,2025-04-05T18:14:06Z,2025-04-05T18:14:06Z,0,@marvel Entertainment....you showed so many animals.....what you did for those poor animals (I hope you understand &quot;poor&quot;) I expect to hear from you marvel.
@carlosalfaro2465,2025-04-05T14:59:32Z,2025-04-05T14:59:32Z,1,Whos playing Kraven? Is it the Kickass guy?
@iamsavagenotaverage,2025-04-04T22:02:27Z,2025-04-04T22:02:27Z,0,It&#39;s kravin time
@Magmatai,2025-04-03T22:13:38Z,2025-04-03T22:13:38Z,0,But does the man come around?
@samarishv,2025-04-03T16:39:12Z,2025-04-03T16:39:12Z,1,Utter flop movie
@nat0106951,2025-04-02T07:53:03Z,2025-04-02T07:53:03Z,2,from kickass to quicksilver then to kraven.
@samsonrao3793,2025-04-02T07:22:44Z,2025-04-02T07:22:44Z,0,It was terrible. Not convincing. Totally predictable 😴
@ItachiUchiha-ws3dy,2025-04-01T16:31:22Z,2025-04-01T16:31:22Z,0,I thought Scott Adkin would be the casting and also would good. But it is what it is.
@BembemEmpasi,2025-04-01T02:33:11Z,2025-04-01T02:33:11Z,0,🎉❤❤❤
@SincerelyLisha,2025-03-31T11:46:21Z,2025-03-31T11:46:21Z,3,This was such a great movie!⭐
@thomasjameson5761,2025-03-31T03:24:56Z,2025-03-31T03:24:56Z,0,10/10 terrible movie
@guylivesay7956,2025-03-30T19:55:36Z,2025-03-30T19:55:36Z,0,"the song was a bad choice. very bland, not interesting. I think a score by Raffertie would&#39;ve been better"
@sonjahildebrand7959,2025-03-30T14:11:58Z,2025-03-30T14:11:58Z,0,❤❤
@harrieyusuf350,2025-03-29T14:42:00Z,2025-03-29T14:42:00Z,0,"Marvel and sony has get their standar so low, <br>I hope robert can revive it, the fx really suck tho"
@iramrafique5660,2025-03-28T22:54:41Z,2025-03-28T22:54:41Z,1,Best ACT.sci.fic movie ever
@beeweb655,2025-03-28T03:59:44Z,2025-03-28T04:00:09Z,2,Terrible acting. Holy crap movies suck
@btothe3345,2025-03-28T01:17:29Z,2025-03-28T01:17:29Z,1,I’ve watched this at least 7x already lol
@LiangHuBBB,2025-03-27T16:51:00Z,2025-03-27T16:51:00Z,1,"just watched it today, its a bit too long.<br>it started off pretty good, but then the slow pacing and when an action scene came up it wasnt even that good - rly bored me.<br>they rly need to hire gareth evans to direct those action scenes"
@tammy6610,2025-03-27T03:40:23Z,2025-03-27T03:40:23Z,1,It&#39;s alot better then the Marvels
@zc5413,2025-03-26T22:44:41Z,2025-03-26T22:44:41Z,1,kRAVEN MAKES RUNNING LOOKS SO GOOD.  So much power and great form in his running style.
@zc5413,2025-03-26T22:39:15Z,2025-03-26T22:39:15Z,1,I SAW THIS ON NETFLIX;  sOOOOO GOOD ;  I WISHED I HAD SEEN IT IN THE Theaters NOW.  HOPEFULLY THEY WEILL RE RELEASE IT IN Theaters.   GOOD MOVIE.   HAS A QUIET HONESTY TO IT.  LOVED IT.
@luvmoney9262,2025-03-26T13:56:25Z,2025-03-26T14:01:37Z,1,YES...KRAVEN IS THE MAN(NOT GOOD AT ALL KILLING ANIMALS)...GARBAGE...REAL TALK
@elvondrago96,2025-03-25T14:14:10Z,2025-03-25T14:14:10Z,1,More! We need MORE!!!!
@taev1987,2025-03-25T14:10:42Z,2025-03-25T14:10:42Z,1,I actually enjoyed the movie! It&#39;s solid! It&#39;s better than most Marvel movies nowadays.
@arielmalsireal5453,2025-03-25T05:01:05Z,2025-03-25T05:01:05Z,1,PEAK
@arielmalsireal5453,2025-03-25T05:00:46Z,2025-03-25T05:00:46Z,0,&quot;It&#39;s Kraving Time!&quot;
@LifeWithLeMaige,2025-03-24T03:12:04Z,2025-03-24T03:12:04Z,1,It was so good
@canttouchthis6439,2025-03-24T00:31:26Z,2025-03-24T00:31:26Z,0,Realizing this is a super hero type movie and though movies like superman and spiderman and the likes have super powers this Kraven character seems kind of to far fetched.
@ivanfricano4023,2025-03-23T23:56:57Z,2025-03-23T23:56:57Z,0,1…2…3
@yelyharmony2047,2025-03-23T15:07:59Z,2025-03-23T15:07:59Z,1,Unless you stop watching superhero movies for a while and then try to watch another one you won&#39;t realize the garbage you&#39;ve been watching all along!
@binky777,2025-03-23T09:59:17Z,2025-03-23T09:59:17Z,1,Looks like Batman vibe and im not disappointed.
@moisesc8395,2025-03-23T03:16:51Z,2025-03-23T03:16:51Z,0,The should of used BAUTISTA as the Kraven Hunter
@thomassticksel5962,2025-03-22T20:15:32Z,2025-03-22T20:15:32Z,0,As close as im getting to a real venom was what i meant.
@aphrodite4473,2025-03-22T16:50:29Z,2025-03-22T16:50:29Z,0,"Gonna be watching this today ,looks good .❤❤❤😊"
@stevencook1050,2025-03-21T05:03:26Z,2025-03-21T05:03:26Z,0,When the MAN comes around. <br><br>no feminists around here... oh boy
@nathanjones1550,2025-03-20T08:46:24Z,2025-03-20T08:46:24Z,1,Its not that its a bad movie. They spent good money.  Its rhe fact that its funny when they probably didnt want me to  laugh. Its cringe and cheesy as hell at some parts.  All in all its good though  like super cool concept.
@NilsMikaelsebastianNilsson,2025-03-19T21:37:37Z,2025-03-19T21:37:37Z,0,It must been some Russian oligarchs 12 year old son who&#39;s never been told no that wrote the dialogue for this movie .. I feel like I&#39;m dying of poisoning 😢😢😢
@NilsMikaelsebastianNilsson,2025-03-19T21:28:39Z,2025-03-19T21:28:39Z,0,There must have been some money laundry involved in making this movie. FBI ARE YOU HEARING ME?????? NSA??????
@alonpalmer,2025-03-18T20:31:13Z,2025-03-18T20:31:13Z,0,"Worst movie ever. One of the quotes was, &quot; she died shortly after the trip, and I never saw her again...&quot;. 😅😅😅😅😅 So stupid..😅😅😅😅"
@KamaRony-g4z,2025-03-17T11:53:54Z,2025-03-17T11:53:54Z,0,Movie available in MP4 movies website.<br>1 step visit <br>2 step scroll down <br>3 step click the Hollywood movie in Hindi 2024
@tashicakennedy3612,2025-03-17T02:50:07Z,2025-03-17T02:50:07Z,1,This movie  is underrated  I like it.
@j.johnson2792,2025-03-16T13:53:59Z,2025-03-16T13:53:59Z,0,Hope they do a kraven venom and sliderman collaboration
@j.johnson2792,2025-03-16T13:43:54Z,2025-03-16T13:43:54Z,0,This was a fun .movie. People were just hating because this wasn&#39;t a Disney marvel film.
@mrgice3,2025-03-16T02:25:26Z,2025-03-16T02:25:26Z,0,Just saw this on Prime and glad I didn&#39;t waste my money in the theater.  MARVEL has lost its credibility.
@ruthwalters5415,2025-03-15T05:24:26Z,2025-03-15T05:24:26Z,2,"I love this movie, highly recommended. 😊"
@jeremiahjohnson731,2025-03-15T00:06:13Z,2025-03-15T00:06:13Z,0,Russell Crow in the Kraven is terrible
@123FUG33,2025-03-14T20:38:10Z,2025-03-14T20:38:10Z,1,Yuri Boyka would have been perfect for this role.
@charlesdavis2891,2025-03-14T13:33:55Z,2025-03-14T13:33:55Z,1,"@marvel, are you guys hiring an animal expert? Clearly by this movie you are lacking in that department. Cape Buffalo in Russia, they live in Africa? Followed by taking the horns? Dumb, not made of Ivory. Bison in Russia makes sense, but again, horns are not made of ivory. So still dumb."
@graememcgowan4939,2025-03-14T05:43:30Z,2025-03-14T05:43:30Z,0,I feel no need to watch the movie after seeing this.
@masone4589,2025-03-14T03:15:35Z,2025-03-14T03:15:35Z,0,I’m 34 minutes in and this thing is staggeringly bad. I had a low bar coming in. I really didn’t expect much. But this thing is still massively underachieving what I expected. Just wow!
@wuzupyou3509,2025-03-13T00:51:37Z,2025-03-13T00:51:37Z,0,Rhino skipped leg day
@MrGaiden100,2025-03-12T00:07:18Z,2025-03-12T00:07:18Z,0,Arent people tired of superhero movies? My god....
@Mello__32,2025-03-11T05:52:41Z,2025-03-11T05:52:41Z,1,"I jus watched this trash, mad I can NEVER get that 2 hrs back...<br>The story in this movie was garbage, weak CGI spots, fight scene with &quot;the rhino&quot; was the weakest, brother turning into a villan, such a terribly played out scenario...<br>The actor that played Kraven, MOST DEFINITELY killed the movie for me, wasn&#39;t believable at all... Another FLOP for Marvel n Sony"
@bbyguin,2025-03-11T04:33:54Z,2025-03-11T04:33:54Z,0,johnny cash
@malawideep7980,2025-03-10T22:31:06Z,2025-03-10T22:31:06Z,1,This is the best Marvel movie rated R  great fight scenes action packed and shows everything...The cast is amazing can&#39;t wait for the sequel... fingers crossed Aaron Taylor-Johnson is incredible!!!!
@joeldiaz141,2025-03-09T22:30:57Z,2025-03-09T22:30:57Z,0,Saw it and give it 6/10
@malawideep7980,2025-03-09T12:49:30Z,2025-03-09T12:49:30Z,3,Best Marvel movie in a long time... action from beginning to end GREAT MOVIE!!!
@megaguy7161,2025-03-07T11:25:37Z,2025-03-07T11:25:37Z,0,"Anyone think that final, unused, shot could&#39;ve paired nicely with that silhouette of him through the cracks in the universe in No Way Home as an end credits scene?<br>He&#39;d stumble across it where he looks down at the aftermath of the battle of Liberty island with the rest of the rogues gallery."
@JacklynRockwell,2025-03-06T05:31:55Z,2025-03-06T05:31:55Z,1,why kravens dad sound more like kraven than kraven 😭🙏
@ShadowReaper-pu2hx,2025-03-01T14:56:42Z,2025-03-01T14:56:42Z,2,"My favorite part was when Kraven said “It’s cravin’ time,” and then got a Crave Case filled with 20 delicious sliders from White Castle while using Craver Nation Rewards to earn points towards his next purchase."
@Aaeonsky..,2025-03-01T04:38:23Z,2025-03-01T04:38:23Z,0,All we need to stop him- Venom
@ItsukiAnime,2025-02-27T18:42:47Z,2025-02-27T18:42:47Z,0,Where is Spider man?
@Raghu-m2h,2025-02-26T09:00:59Z,2025-02-26T09:00:59Z,1,Ultimate Spider-Man
@carstereo2493,2025-02-25T02:31:45Z,2025-02-25T02:32:19Z,1,"I think they got the actor Aaron Taylor-Johnson pretty close to what Kraven in the comics is like, ie his height and weight. Kraven in the comics is around 6&#39; to 6.2&#39; and 235lbs. Taylor is 5&#39; 11&quot; and 200lbs here, he put on about 30lbs for the movie."
@sheikhhajee03,2025-02-22T06:51:32Z,2025-02-22T06:51:32Z,3,Best movie ever❤
@AndruBooth,2025-02-21T17:34:17Z,2025-02-21T17:34:17Z,3,"If you thought Madam Web was trash and Morbious wasn&#39;t great, then stear clear of this absolute horrendous film. It makes the other two looks like box office hits."
@Gripgoals,2025-02-19T07:35:59Z,2025-02-19T07:35:59Z,0,"<a href=""https://www.youtube.com/watch?v=I8gFw4-2RBM&amp;t=59"">0:59</a>"
@davewevans,2025-02-18T03:17:42Z,2025-02-18T03:17:42Z,0,"Marvel, please stop allowing Hollywood to alter origin stories. Comic books are cherished for a reason. Movies should not change the narratives, character dynamics, or how characters acquire their powers. This is partly why DC has been performing better; they stick closely to the comic scripts. I love Marvel, but the recent movies have not been up to par. Please, “do better” and take a stand. You can earn more by creating quality films instead of compromising and not gaining anything in return."
@ibobeko4309,2025-02-17T19:31:08Z,2025-02-17T19:31:08Z,1,"One of the worst movies ever, i watched like 10000 movies in my life easily, this one is boring, so bad. <br>The writing is bad, the acting is bad, the cgi feels cheap, the story is bad, there is absolutely nothing good about this movie, the whole Russian mafia style backstory is so boring and the enemies have such stupid powers. This movie cost $120 million, that is a lot of money for such a crap."
@KV_87,2025-02-16T16:38:17Z,2025-02-16T16:38:17Z,0,"Maximus the father,Lucius the son and Caracalla from nowhere like little brother none like or pity in this universe!!"
@genevajanopol7295,2025-02-12T09:53:29Z,2025-02-12T09:53:29Z,0,Sana may part two to kasi yung Kapatid nya nag iba na din
@genevajanopol7295,2025-02-12T09:53:00Z,2025-02-12T09:53:00Z,0,Sobrang ganda recommended ko talaga to
@kazeemkhan8250,2025-02-09T08:59:38Z,2025-02-09T08:59:38Z,4,What a load of crap
@Enough1968,2025-02-09T04:38:29Z,2025-02-09T04:44:15Z,5,ABSOLUETLY AWESOME MOVIE!! HOW PHENOMENAL DOES ARRON TAYLOR-JOHNSON LOOK IN THE MOVIE!!! I ABSOLUETLY LOVE HIS MOVIES. HE WOULD BE AN AWESOME WOLVERINE AS WELL!!! I LIKED THE ENDING POSE WHEN HE PUTS THE LION VEST ON AND SITS JUST LIKE BLACK ADAM DOES ...❤ DIDNT ANYONE SEE THAT COMING?  ( im saying it in a  Russian accent)   😂❤😉😛
@uusagiyojimbo,2025-02-07T02:48:04Z,2025-02-07T02:48:04Z,0,"They always find a way to....Larry H Parker got me, well, you know the story."
@newblue3256,2025-02-05T19:17:54Z,2025-02-05T19:17:54Z,0,Hope this wins an Oscar for worst use of a johnny cash song in a trailer
@Thats_wack_dawg,2025-02-01T15:46:30Z,2025-02-01T15:46:30Z,0,Only watching this for Fred Hechinger
@dubdoodle7191,2025-02-01T12:57:02Z,2025-02-01T12:57:02Z,1,"Very poor colorization, details washed out by unusual dark levels. Was film edited on a laptop ?"
@prahashpurbey8538,2025-02-01T09:35:03Z,2025-02-01T09:35:03Z,0,Yoooo is that really marvel 😭🔥
@bradleymccoon885,2025-02-01T02:26:33Z,2025-02-01T02:26:33Z,0,I hope that the winter soldier is the cousin of Kraven and Dimitri
@josephineicuka-asumo2570,2025-01-31T21:45:14Z,2025-01-31T21:45:14Z,3,I freaking loved this movie. 🤗
@WilfredoRivera-l5x,2025-01-30T07:47:49Z,2025-01-30T07:47:49Z,1,Nice 😊 awesome movie&#39;s coming on now 🎉🎉🎉🎉
@aleynab8583,2025-01-27T00:21:17Z,2025-01-27T00:21:17Z,3,"Ill go watch it again, really liked it"
@kakamalnor,2025-01-25T05:42:33Z,2025-01-25T05:42:33Z,2,Just watched it. It wasn&#39;t great but watchable. The plot is flat and predictable. The current rating 5.4 is just about right.
@rob4365,2025-01-24T10:20:44Z,2025-01-24T10:20:44Z,0,My favorite part was when the movie ended
@boroboro462,2025-01-23T10:57:41Z,2025-01-23T10:58:13Z,1,why is it everyone joking bout this movie? is it badly made or what bcos i never even know bout this character so i dont know how to judge.. I&#39;m seriously asking
@josephcomeros7472,2025-01-23T09:25:04Z,2025-01-23T09:25:04Z,3,"After seeing the movie, I&#39;m pretty sure Kraven is stronger than Captain America."
@Annaks-n1p,2025-01-22T22:43:09Z,2025-01-22T22:43:09Z,1,To much blood
@ksk1139,2025-01-22T10:39:51Z,2025-01-22T10:40:15Z,0,Rate 4.5/10⭐️ 🌚
@ДимычГабченко-м8ъ,2025-01-21T19:30:38Z,2025-01-21T19:30:38Z,0,Этот фильм по сцэнарию СУПЕРМЭН! Совсем не рэальный а просто Сказочка для школьников! Опять все в него стреляют никто не попадает прыгает получше чем чел паук🤣 вобщим деткам на потеху😂 я этого тарзана смотреть нехочу 😂 😂😂
@Holyhoopstv,2025-01-21T18:10:11Z,2025-01-21T18:10:11Z,0,There’s already a babayaga and his name is JOHN WICKKK !!!
@darrellkendall5347,2025-01-21T03:19:22Z,2025-01-21T03:19:22Z,0,I just watched on Amazon..... Rough watch. Maybe a 4/10.
@THEGARNERCOLLECTIVE,2025-01-20T03:56:56Z,2025-01-20T03:56:56Z,0,I actually thought he got his powers from his dad. Watching now I thought it be set in usa and stuff. I actually thought it was about him hunting and killing animals too. Not good film
@meleklane8924,2025-01-20T03:08:17Z,2025-01-20T03:09:24Z,0,Superb action pack in the cinemas.
@stonehorsegoeman6158,2025-01-20T02:28:19Z,2025-01-20T02:28:19Z,0,Toooo violent for meee arrggh!
@ukishhven7624,2025-01-19T13:35:03Z,2025-01-19T13:35:03Z,7,"Kraven the Hunter is a cinematic masterpiece that pushes the boundaries of action filmmaking! The actors delivered performances so raw and electrifying that they felt almost otherworldly capturing the essence of their characters with an intensity that leaves you speechless. The stunts are nothing short of jaw-dropping, a perfect symphony of danger and precision, executed with such finesse that they redefine the standard for action choreography. Every fight sequence is an adrenaline-fueled masterpiece, blending art and chaos seamlessly. The commitment and passion poured into this film by the entire cast and crew are evident in every frame. Truly, Kraven the Hunter sets a new bar for action films, leaving an unforgettable mark on the genre."
@vnblogs1085,2025-01-18T17:49:50Z,2025-01-18T17:49:50Z,1,Karavan 2 movie is not end outstanding performance by Aaron Taylor-Johnson❤❤
@vnblogs1085,2025-01-18T17:49:07Z,2025-01-18T17:49:07Z,2,Aaron Taylor-Johnson as a hunter fabulous outstanding body ultimate performance ❤❤ fabulous ❤❤
@Nikkcade,2025-01-18T17:01:32Z,2025-01-18T17:01:32Z,1,I guess the man never did come around.
@QNag,2025-01-18T11:42:15Z,2025-01-18T11:42:15Z,0,The single worst movie I’ve ever seen.  <br>The guy with the lil backpack 😂
@crazybkallday,2025-01-17T07:16:40Z,2025-01-17T07:16:40Z,0,I told u it was trash before it even came out
@israelguadarrama4268,2025-01-17T00:34:11Z,2025-01-17T00:34:11Z,0,Is not bad!!! It&#39;s terrible lol Sony please step away and let them adults do the job  and please actors don&#39;t take this roles!!
@RaphaelClancy,2025-01-17T00:22:40Z,2025-01-17T00:22:40Z,0,"I wonder how many people who were involved in this project know what the word craven means? To be fair, I don&#39;t know the lore. Maybe he&#39;s supposed to be a worthless coward?"
@natashafrancis2013,2025-01-17T00:00:51Z,2025-01-17T00:00:51Z,2,"I loved it, Kraven soooooo hot 😅😊😊"
@AllOutSports8,2025-01-16T20:47:55Z,2025-01-16T20:48:08Z,1,Kickass grew up
@chaoschaos2197,2025-01-15T23:19:03Z,2025-01-15T23:25:42Z,1,"There&#39;s your next superman!! If the Henry dude doesn&#39;t want to any more (I know he said no already, but $ has a way of changing minds! Even kryptonian ones😆). This guy has the look!"
@dmosill,2025-01-15T05:16:46Z,2025-01-15T05:16:46Z,1,"This movie was terrible from the opening scene to the credits, pure garbage."
@jadetiger88888,2025-01-15T05:08:26Z,2025-01-15T05:08:26Z,2,"It’s not the perfect movie, but it was pretty good. I mean the lead actor was really nice to look at so I’m looking forward to another movie with him in it so I hope there’s a sequel."
@SuzanaQafoku,2025-01-14T21:59:42Z,2025-01-14T21:59:42Z,0,The best movie no fansi weapons no aliens no crazy powerful people e movie to watch
@stormdelight4274,2025-01-14T15:00:24Z,2025-01-14T15:00:24Z,1,"I thought I&#39;m gonna hear my favourite lines again lol. My son, the day you were born, the very forests of Lordaeron whispered the name Arthas."
@Мария-н9п7р,2025-01-13T20:44:29Z,2025-01-13T20:44:29Z,0,Kraven is not a Russian name thought 😒
@Gastothaking,2025-01-12T16:03:00Z,2025-01-12T16:03:00Z,0,Is this Out I mean HD
@GAMESEPIC-ye5gp,2025-01-12T10:51:49Z,2025-01-12T10:51:49Z,0,Character 🔥 actor 🔥 movie 🤡 script 🤡
@asomamongajoel4645,2025-01-12T03:52:16Z,2025-01-12T03:52:16Z,5,"My son, you&#39;re a killer not a hunter"
@NhoyskieIbanez,2025-01-11T19:59:38Z,2025-01-11T19:59:38Z,0,Nice Movie! but the power of “The Foreigner@ is lame 😅😅
@JayD.moviey,2025-01-11T18:32:38Z,2025-01-11T18:32:38Z,2,"Tylor Johnson is most handsome and underrated actor😢,plz give him to classic masterpiece script 🎥❤️"
@JayD.moviey,2025-01-11T18:28:10Z,2025-01-11T18:28:10Z,1,"I&#39;m the Great fan of Tylor johnson, literally his killer action look😍👊"
@nemono-won7712,2025-01-11T17:23:10Z,2025-01-11T17:23:10Z,1,"Havent seen it ...<br>And after this pathetic excuse for a trailer, i plan NOT to at all costs. 👎👎👎 <br>I WOULD PAY NOT TO WATCH THIS"
@tightenup82,2025-01-11T17:22:32Z,2025-01-11T17:22:32Z,0,Please stop making these
@TheRenaissanceGuys,2025-01-11T01:30:59Z,2025-01-11T01:30:59Z,0,3/10 movie
@matojo3280,2025-01-11T00:09:24Z,2025-01-11T00:09:24Z,2,I saw this movie yesterday and it was FCKN.. GREATT!! Im ready to buy a DVD asap💯💯
@BIGUS_PENUS,2025-01-10T02:21:10Z,2025-01-10T02:21:25Z,1,The stench of failure on this one .. REEKS 👎<br>Im starting to believe Sony uses these crappy movies as a TAX DEDUCTION and not a serious investment
@laurickmvondo9030,2025-01-09T21:45:47Z,2025-01-09T21:45:47Z,2,"Just saw the movie and I’m still overwhelmed because of how good it was. True action scenes, much better than whatever we got in the latest marvel movies. Hope the movie gets the recognition it deserves."
@lashatotladze5211,2025-01-09T17:26:50Z,2025-01-09T17:26:50Z,1,I just watched that movie. It is great but i think i just saw something like marvel... something like x-man &quot;to be continued&quot; maube the next parts will appear and please pin my post )
@Silktheshocker88,2025-01-09T05:18:35Z,2025-01-09T05:18:35Z,0,Morbious 2..
@zhougong9957,2025-01-08T20:29:33Z,2025-01-08T20:29:33Z,1,This movie is better than you thought it is 😊❤😊❤
@NikiDrozdowski,2025-01-07T17:13:36Z,2025-01-07T17:13:36Z,0,It&#39;s definitely R-rated what Sony did to that Johnny Cash song ...
@jayduke8554,2025-01-06T18:56:42Z,2025-01-06T18:56:42Z,0,This is Disney?
@도라에몽-b8j,2025-01-06T12:45:58Z,2025-01-06T12:45:58Z,0,백인 누나좀 나오게요
@Alex-l1j7y,2025-01-06T12:12:02Z,2025-01-06T12:12:02Z,0,"Can’t wait for em to say, “It’s KRAVEN TIME!”"
@tri3183,2025-01-06T05:24:11Z,2025-01-06T05:24:11Z,0,its morbin time 😂
@lightmiso4962,2025-01-06T04:56:20Z,2025-01-06T04:56:20Z,0,Like if you can no longer unhear these words…<br><br><br><br><br><br><br><br><br><br><br><br><br><br><br><br><br>“When the man comes around.” 😂
@Mr.Dishrespect,2025-01-06T01:01:58Z,2025-01-06T01:01:58Z,0,I have seen the movie and is impressed me how much humble the main character was... Words as I&#39;m the best on this on that... Dude let someone else say things about you stop boasting you not a kid.... In general Marvel Loki&#39;s character way superior in every aspect... Every year movies goes worst.
@user-zym464com,2025-01-04T22:33:27Z,2025-01-04T22:33:27Z,1,Плохо говорит по русски…
@FAHA-q1j,2025-01-04T20:58:56Z,2025-01-04T20:58:56Z,0,It&#39;s not good movie
@iggypop2026,2025-01-04T06:32:09Z,2025-01-04T06:32:09Z,0,The corny Russian accents ruins the movie
@dustingibson1796,2025-01-04T01:43:55Z,2025-01-04T01:44:18Z,0,"When people start actually watching these films before reviewing them, we will go back to when the time was cinema was actually respected… I liked this movie"
@michaelyurik5254,2025-01-03T16:51:01Z,2025-01-03T16:51:01Z,0,Origin story i wanna see a spidey fight why aint he in new york
@gracebellamy586,2025-01-02T20:43:25Z,2025-01-02T20:43:25Z,1,So... Russian... villain. Makes sense.
@nanatsanatad,2025-01-02T16:56:41Z,2025-01-02T16:56:41Z,0,Πολύ καλή ταινία . Δεν είμαι και πολύ φαν του είδους αλλά η ταινία δεν με άφησε λεπτό να βαρεθω. Την συνιστώ ανεπιφύλακτα.
@DVXDemetrivs,2025-01-01T21:53:06Z,2025-01-01T21:53:06Z,0,These people have absolutely no idea how Russian prison colonies work....
@masterfalse6311,2025-01-01T18:36:32Z,2025-01-01T18:36:32Z,0,The only thing I will remember from this trailer is that “When the man comes around” 🗿🔥
@epictrailers3489,2025-01-01T17:45:27Z,2025-01-01T17:45:27Z,0,Ngl. I actually think this movie is slightly overhated I actually liked it. Saw it last night Dec 31 2024 to finish the year 😊
@ABX-KRS,2025-01-01T13:13:53Z,2025-01-01T13:13:53Z,0,I got goosebumps when Aaron said it&#39;s kraving time and kraved all over the place
@watchara9630,2025-01-01T06:28:25Z,2025-01-01T06:28:25Z,0,ใครไปดูละบ้าง แนะนำที
@Ashley_On_Paws15,2025-01-01T05:12:10Z,2025-01-01T05:12:10Z,0,1st day 2nd show <br>❤❤
@longmelinda,2025-01-01T04:26:32Z,2025-01-01T04:26:32Z,0,"The previews are better than the movie  . . . bcuz of too much character talking/history, b4 &#39;Kraven&#39; starts kicking tail. [Few unnecessary scenes.] <br>Needless to note,  I will watch again when available on Stream TV."
@opemberoyalty1946,2024-12-31T12:16:47Z,2024-12-31T12:16:47Z,0,They should have made it whitepantha😂
@Sigma10-c1k,2024-12-31T06:58:45Z,2024-12-31T06:58:45Z,0,If spiderman aint in it you know where you can stick !!!!
@ajnorfolk9628,2024-12-31T02:31:46Z,2024-12-31T02:31:46Z,0,That&#39;s KICKASS! He&#39;s gotten older but that&#39;s kickass completely!
@mysteriouslytrue,2024-12-31T01:27:37Z,2024-12-31T01:27:37Z,2,why does kraven remind me of wolverine?
@WhimsicalWildcat-c3z,2024-12-31T00:32:15Z,2024-12-31T00:32:15Z,0,So is Aaron Taylor going to be the One Above All eventually?
@Newfoundland_Imperials,2024-12-30T23:26:53Z,2024-12-30T23:26:53Z,0,Why didn&#39;t you guys make a Kraven comic reboot FIRST and see how it sells before you made the movie?
@pygmy-goats-kevin,2024-12-30T21:25:12Z,2024-12-30T21:25:12Z,2,WOW AMAZING MOVIE VERY ENTERTAINING ❤️💖❤️
@DocDelta89,2024-12-30T04:44:21Z,2024-12-30T04:44:21Z,0,Great Trailer.<br>Meh Movie.
@AlexanderBlumenau,2024-12-30T00:32:47Z,2024-12-30T00:32:47Z,0,yet another demonstration that cinema is really dead ...
@clazwickliffe8327,2024-12-29T23:57:26Z,2024-12-29T23:57:26Z,1,This looks good
@eliteelite7428,2024-12-29T04:07:40Z,2024-12-29T04:07:40Z,0,The worst is crowe with his nonsense accent 😂
