author,published_at,updated_at,like_count,text
@kensredemption,2024-08-19T01:11:31Z,2024-08-19T01:11:31Z,0,Can we just start embracing R-rated comic book movies again? I feel like we were trending in this direction since Logan and TSS.
@aldozamora4746,2024-08-19T00:52:26Z,2024-08-19T00:52:26Z,0,why making him a good guy? he’s a villain
@empyres,2024-08-19T00:52:19Z,2024-08-19T00:52:19Z,0,best version of the song. cant find it though. rip mister cash
@rishen,2024-08-19T00:42:49Z,2024-08-19T00:42:49Z,0,What&#39;s Zeus and Pietro doing here? Kinda sus.
@awanthenext7991,2024-08-19T00:02:04Z,2024-08-19T00:02:04Z,0,Hei it&#39;s quicksilver
@Lilkels,2024-08-18T23:51:53Z,2024-08-18T23:51:53Z,0,Ima need marvel to do a regular action film no super powers with Jason Stratham and Tyrese
@gamingwithgoozer,2024-08-18T22:39:17Z,2024-08-18T22:39:17Z,0,"Look they have done nothing to earn my trust beyond the Venom movies, but I have to say this one actually looks like it could be a fun bloody movie."
@rob_patrick1,2024-08-18T22:31:01Z,2024-08-18T22:31:01Z,0,Sony execs shoving spiderman less movies nobody wants to see :<br>&quot;you didn&#39;t see that coming?&quot; 😂
@josephphiri4381,2024-08-18T22:22:58Z,2024-08-18T22:22:58Z,0,From MCU Quick Silver to Sony CU Kraven. The TVA needs to shed more light on this.
@CiscoNov1947,2024-08-18T22:20:32Z,2024-08-18T22:20:32Z,1,Russell crowe is more kraven than the actor they cast 😂
@WillemenJ,2024-08-18T22:04:19Z,2024-08-18T22:04:19Z,121,"My favourite part was when Gladiator says ‘are you crazy?!, and Kraven says ‘no, I’m Kravey’ 🔥"
@OptemusPr1meXBox,2024-08-18T21:45:06Z,2024-08-18T21:45:06Z,1,How is Russel Crowe Zeus and Kraven&#39;s daddy? 😒🙄
@masudurrahmansiam7154,2024-08-18T21:17:08Z,2024-08-18T21:17:08Z,1,Flop movie for sure
@ToneX3,2024-08-18T21:13:06Z,2024-08-18T21:13:06Z,0,I’m confused.. is it some puny Sony “marvel” entry? Or is it going to be more like Logan.. a gritty story that somehow fits into their universe?
@josiahw7634,2024-08-18T21:12:11Z,2024-08-18T21:12:11Z,1,anybody else notice how Kraven didn&#39;t say a single word this whole trailer
@cliptwitchtoriss,2024-08-18T20:41:19Z,2024-08-18T20:41:19Z,0,"Rediseñen a Rhino, nmmn, parece gárgola, hagan lo mismo que con Sonic, Ya arruinaron una vez a Rhino en The Amanzing Spider-Man, no lo hagan de nuevo"
@mahmoudfathi9173,2024-08-18T20:29:57Z,2024-08-18T20:29:57Z,4,Marvel has made a movie that absolutely no one cares about
@DavidW.WardJR,2024-08-18T19:59:36Z,2024-08-18T19:59:36Z,0,This is a Christmas movie
@georgeemery3295,2024-08-18T18:59:02Z,2024-08-18T18:59:02Z,2,Wow this movie is going to suck
@arvindjayakandan7439,2024-08-18T18:58:03Z,2024-08-18T18:58:03Z,0,I feel morb vibes
@doro626,2024-08-18T18:52:29Z,2024-08-18T18:52:29Z,0,"I have no interest in the Sonyverse, however I see a missed opportunity for making Morlun the villain behind Morbius and this movie ( possibly Madam web as well)."
@ValyrianPrince,2024-08-18T18:43:16Z,2024-08-18T18:43:16Z,0,I think it will be fun and stupid
@werewolfzombie8853,2024-08-18T18:39:34Z,2024-08-18T18:39:34Z,0,RHINOOOOOO
@lifecirclegroupstore,2024-08-18T17:40:12Z,2024-08-18T17:40:12Z,0,Oh my god... 💪
@IchiGoDunze15,2024-08-18T17:36:55Z,2024-08-18T17:36:55Z,0,"I have a feeling a feeling that Kraven the Hunter will flop. If Marvel’s Black Cat gets her own movie, will it flop."
@pulkitrai911,2024-08-18T17:30:37Z,2024-08-18T17:30:37Z,0,Puri movie toh trailer mein he dikha diya
@Love-gx8ul,2024-08-18T17:20:18Z,2024-08-18T17:20:18Z,0,Why marvel fans so negative? 😂😂
@ChellappanChellappan-if8ic,2024-08-18T17:07:24Z,2024-08-18T17:07:24Z,1,Only trailer
@LOLIETLEWDWING24,2024-08-18T17:06:50Z,2024-08-18T17:06:50Z,2,"TRASH 🗑️ why did they even waste their time on this bullshit, stick to what’s making the money because THIS WONT"
@LOLIETLEWDWING24,2024-08-18T17:06:15Z,2024-08-18T17:06:15Z,0,FLOP!!! 🥱🥱🥱🥱🥱🥱🥱🥱🥱🥱🥱 when is brave new world coming out
@m.gwuapo_,2024-08-18T17:02:37Z,2024-08-18T17:02:37Z,1,Def finna see this 👀👀
@liecretsev,2024-08-18T17:00:17Z,2024-08-18T17:00:17Z,0,Disappointment I felt when there&#39;s no one making the &quot;Release the Kraven&quot; joke
@paxtonebright2951,2024-08-18T16:06:57Z,2024-08-18T16:08:28Z,0,Producer: How much testosterone and machismo do you want in this movie? Sony: Yes.
@ashesfrombones,2024-08-18T16:04:08Z,2024-08-18T16:04:08Z,0,"Super hero tropes: generic mercenaries team shooting in the dark, the hero pop-ups from here and there and disappeared"
@mobbu4311,2024-08-18T15:47:27Z,2024-08-18T15:47:27Z,0,"I mean, it&#39;s alright? right?"
@koleMe88,2024-08-18T15:46:32Z,2024-08-18T15:46:32Z,0,Yesssssss
@IOddAm,2024-08-18T15:40:38Z,2024-08-18T15:40:38Z,0,Looks much better after reshoots. Still Morbius quality
@halflightdnb,2024-08-18T15:30:33Z,2024-08-18T15:30:33Z,0,Oooo it&#39;s Pollux Troy! Hope his brother Castor is in it too.
@KanorKaruchle,2024-08-18T15:27:11Z,2024-08-18T15:27:11Z,0,I think it will fail. Similarly to Morbius.
@nitishnag3444,2024-08-18T14:45:58Z,2024-08-18T14:45:58Z,2,Wow
@wewatchmovies4446,2024-08-18T14:42:07Z,2024-08-18T14:42:07Z,0,Why is this trailer so visually dark?
@anirudhn4465,2024-08-18T14:35:50Z,2024-08-18T14:35:50Z,0,"I hope He says, &quot;It&#39;s not about Kra why or kra what. It&#39;s about kraVeN&quot;"
@AdLa-Flare,2024-08-18T14:33:12Z,2024-08-18T14:33:12Z,0,God this looks bad…. I don’t think ATJ is a great actor. He’s just average to me
@brederodes,2024-08-18T13:52:01Z,2024-08-18T13:52:01Z,0,Zzzzzzzzzzzzz
@nathanielelloreg6574,2024-08-18T12:52:01Z,2024-08-18T12:52:01Z,0,I can see this one fail too..
@Beardtimeline0613,2024-08-18T12:40:54Z,2024-08-18T12:40:54Z,0,So his father is ones  Zeus
@gothamknight3871,2024-08-18T12:16:54Z,2024-08-18T12:17:20Z,0,"Sooooooooo, more meme fun from Sony’s attempt at a Spider-Man movie without Spider-Man?"
@L_r_k_r,2024-08-18T12:07:03Z,2024-08-18T12:07:03Z,0,"Knowing Sony, they&#39;ll remove all the blood and gore for the PG 13 release."
@Lostsin.s,2024-08-18T11:46:29Z,2024-08-18T11:46:29Z,0,I think the biggest lesson ima learn from seein this is when the man comes around
@harrisonhillz4617,2024-08-18T11:32:44Z,2024-08-18T11:32:44Z,0,Tangerine the Hunter
@typeact1v1t1es,2024-08-18T11:04:33Z,2024-08-18T11:04:33Z,1,We Got Kraven’s Dad before GTA 6
@idianictus6688,2024-08-18T10:58:12Z,2024-08-18T10:58:12Z,0,Whos next? SONY!
@stressoutspiderman,2024-08-18T10:12:43Z,2024-08-18T10:12:43Z,0,Is that quicksilver?
@woozychoo,2024-08-18T08:47:15Z,2024-08-18T08:47:15Z,0,"Honestly, I just wanna see a good action, blood, hot bodies and listen to nice soundtrack."
@shazamprojecti5040,2024-08-18T08:41:39Z,2024-08-18T08:41:39Z,0,Soo long release date delayed fainali
@maneeshithapliyal4022,2024-08-18T08:34:12Z,2024-08-18T08:34:12Z,1,Featuring quick silver as kraven
@leesanghong80,2024-08-18T08:34:00Z,2024-08-18T08:34:00Z,0,dh18b
@jeffpark3651,2024-08-18T08:31:49Z,2024-08-18T08:31:49Z,0,I really hopr this is actually aa good portrayal of kraven; guy is always slept on. literally died in the insomniac game too :((
@justin555666,2024-08-18T08:31:44Z,2024-08-18T08:31:44Z,0,Hey Sony… Stop it!
@harshjaiswal9368,2024-08-18T08:27:35Z,2024-08-18T08:27:35Z,1,Pietro in a parallel universe
@Nonactornonactor,2024-08-18T08:27:20Z,2024-08-18T08:27:20Z,0,LIKE IF YOU LMAO&#39;D!
@Oldshirt,2024-08-18T08:10:28Z,2024-08-18T08:10:28Z,0,Wait what was the name of that song?
@realinck,2024-08-18T08:07:04Z,2024-08-18T08:07:04Z,0,Marvel and Sony are coming back 😮
@ntad6580,2024-08-18T06:49:38Z,2024-08-18T06:49:38Z,0,Gonna be garbage
@SaraikiPlayStation,2024-08-18T06:44:52Z,2024-08-18T06:44:52Z,0,😮
@IGNiiSonKod3in,2024-08-18T06:33:32Z,2024-08-18T06:33:32Z,1,Marvel always do it<br>You never disappoint thank you 😊
@RentDodger,2024-08-18T05:45:35Z,2024-08-18T05:45:35Z,1,I was skeptical at the first trailer but this looks decent ngl
@peterscoop2647,2024-08-18T05:31:03Z,2024-08-18T05:31:03Z,0,Looks like a 10
@nicolaspollet4839,2024-08-18T05:28:56Z,2024-08-18T05:28:56Z,0,"Zeus is Kravens dad??? LOL. No but seriously, this looks pretty terrible."
@idontneedsleep...ineedansw7007,2024-08-18T05:12:20Z,2024-08-18T05:12:20Z,0,broo are they gonna show white tiger??!?!?
@ronnieortiz6803,2024-08-18T05:01:27Z,2024-08-18T05:01:27Z,0,I see they skipped showing us that dumb as hell Lion&#39;s blood scene from the first trailer 😂
@KandosX,2024-08-18T04:55:29Z,2024-08-18T04:55:29Z,0,"am i the only one with the &quot;kinda meh&quot; reaction ? <br>Like who even is this character? was he popular in some sort of comics? i understand that he is suppose to be a villain for spiderman.<br>But come on, atleast introduce him in some other marvel movie as a Cameo. Form some connection. You just randomly show a hunter dude that has some animalistic powers out of nowhere.<br>Where was he during the thor movies? or where was he during the thanos snap ? Who is he ? This is weird."
@zsedcftglkjh,2024-08-18T04:54:59Z,2024-08-18T04:54:59Z,0,Hey...I think a man comes around.
@tumainibanvunyaki1890,2024-08-18T04:48:35Z,2024-08-18T04:48:35Z,0,cgi is bad
@vengeance2277,2024-08-18T04:44:11Z,2024-08-18T04:44:11Z,0,"my most favourite part is when he said &quot;im not just hungry, i&#39;m kravin&quot; and kraved all over."
@SpicyTunaRollxoxo,2024-08-18T04:31:56Z,2024-08-18T04:31:56Z,0,You know my favorite thing about Spiderman? Spiderman.
@thefightoffaith,2024-08-18T04:22:51Z,2024-08-18T04:22:51Z,0,"That&#39;s the 2nd time now that song is in marvel, similar looking movies, ahaha 🤣"
@chadlin866,2024-08-18T03:52:57Z,2024-08-18T03:52:57Z,0,It&#39;s morbing time.
@phaedrus7971,2024-08-18T03:13:30Z,2024-08-18T03:13:30Z,2,"I clicked because I thought this was Draven, the story of a half dragon and half man."
@Apprentice29,2024-08-18T02:34:42Z,2024-08-18T02:34:42Z,0,They better not butcher this like they did Madam Web! Kraven the Hunter is one of my all time favorites!
@owennelson2059,2024-08-18T01:52:09Z,2024-08-18T01:52:09Z,1,Box office fail
@BOMEFSY,2024-08-18T01:42:41Z,2024-08-18T01:42:41Z,0,Guess they are not going with the reality TV spin.
@OliWo1i,2024-08-18T01:00:42Z,2024-08-18T01:00:42Z,0,i hope this is good cus this trailer is really promising
@cammychoate,2024-08-18T00:56:42Z,2024-08-18T00:56:42Z,0,"My favorite part is when he says, &quot;I&#39;m Kraven some violence&quot; then Kravens all over the place"
@altarush,2024-08-18T00:34:58Z,2024-08-18T00:34:58Z,0,This going to be better than Snow White.
@HakTunes,2024-08-18T00:16:51Z,2024-08-18T00:16:51Z,0,This look tuff!
@eduardoflores1503,2024-08-18T00:12:43Z,2024-08-18T00:12:43Z,1,It&#39;s Kraving Time
@Messi10HDofficial,2024-08-17T23:51:19Z,2024-08-17T23:51:19Z,0,At least he didn’t die from shots from above this time
@iamcharane,2024-08-17T23:44:01Z,2024-08-17T23:44:01Z,0,I cannot be the only one who thinks this is going to be utter hogwash..am I? 👀
@andrepowell2236,2024-08-17T23:19:04Z,2024-08-17T23:19:04Z,0,It’s morphin time
@rizot0ny1996,2024-08-17T23:14:24Z,2024-08-17T23:14:24Z,0,Hard pass
@sympathysong,2024-08-17T23:05:04Z,2024-08-17T23:05:04Z,0,🔥🔥🔥
@Mimic-xebra,2024-08-17T22:59:22Z,2024-08-17T22:59:22Z,0,"Biggest take away from this trailer, Kraven has daddy issues"
@royjones8312,2024-08-17T22:33:13Z,2024-08-17T22:33:13Z,0,He was in the Amazon with my mom hunting Rhino’s right before she died.
@klee329,2024-08-17T22:19:35Z,2024-08-17T22:19:35Z,0,I’m very excited to see how much worse Sony’s Marvel movies can get
@Backfromthedeadguy,2024-08-17T22:18:40Z,2024-08-17T22:18:40Z,0,"I know people are already jumping on the hate wagon, but I&#39;m going to give this an honest chance."
@BenSchulks,2024-08-17T22:14:19Z,2024-08-17T22:14:19Z,0,This trailer&#39;s awesome animal was gonna be wicked
@syedabrar1724,2024-08-17T21:50:50Z,2024-08-17T21:50:50Z,0,Virat kohli?
@ThePelon239,2024-08-17T21:46:17Z,2024-08-17T21:46:17Z,1,Lame: The Movie
@AndroiDavs,2024-08-17T21:30:56Z,2024-08-17T21:30:56Z,0,Another lackluster film
@jakerodriguez8869,2024-08-17T21:26:52Z,2024-08-17T21:27:19Z,0,Wow that was a good movie. I saw the whole thing in this trailer. Definitely gonna be watching it again.
@CC-br4qm,2024-08-17T21:21:18Z,2024-08-17T21:21:18Z,0,Kraven is a villian hough <br><br>Not some anti hero <br><br>Marvel is ruining it all
@jeffreyworthen7033,2024-08-17T21:21:01Z,2024-08-17T21:21:01Z,0,Aaron Taylor -Johnson (Kraven) looks like a poster child for Met-Rx....💪💪💪🤣🤣🤣
@zombiekiller22000,2024-08-17T21:18:31Z,2024-08-17T21:18:31Z,0,"I want to say this looks good! It definitely doesn&#39;t, but I want to say it does."
@mellettron360animations,2024-08-17T21:03:29Z,2024-08-17T21:03:29Z,0,"I like the part when he says, “It’s Kraven Time”."
@michaelessiet5172,2024-08-17T20:54:17Z,2024-08-17T20:54:17Z,0,Not a fan of the rhino here but looking forward to the movie
@matthewhansen9423,2024-08-17T20:44:28Z,2024-08-17T20:44:28Z,0,"Kraven, The Rhino Man, RCrowe, I&#39;m  in!"
@levifout60882,2024-08-17T20:39:23Z,2024-08-17T20:39:23Z,1,Rhino in the classic suit from SM TAS and Spectacular Spider-Man!!!! So freaking awesome!!!!
@KiriakosVilchez,2024-08-17T20:39:04Z,2024-08-17T20:39:30Z,427,Post-credits scene of Kraven seeing a photo of Vulture in a newspaper stand in New York and saying &quot;this bird needs its wings clipped.&quot; 😂😂😂😂
@drunkenmonkey28,2024-08-17T20:35:46Z,2024-08-17T20:35:46Z,1,“When the MAN comes around” will haunt me as bad as Kraven hunts the MEN in this movie.
@elias41790,2024-08-17T20:15:16Z,2024-08-17T20:15:16Z,0,So is his father Zeus Russel Crowe or did they just have him doing 2 roles now
@xtrabandz00,2024-08-17T20:14:52Z,2024-08-17T20:14:52Z,0,Was that rhino 😨😱
@aliceeeeeeeeee5662,2024-08-17T20:11:59Z,2024-08-17T20:11:59Z,0,The supporting cast tho❤❤❤
@harrystarmore3350,2024-08-17T19:51:33Z,2024-08-17T19:51:33Z,0,I think the man is coming round
@seanedits10,2024-08-17T19:41:33Z,2024-08-17T19:41:33Z,0,1.2 million views in 3 days 😂
@agentprime2179,2024-08-17T19:19:37Z,2024-08-17T19:19:37Z,2,That song was in Logan’s end credits.
@derekgonzalez9512,2024-08-17T19:10:32Z,2024-08-17T19:10:32Z,0,I don&#39;t have high hopes for this movie.....I believe it&#39;s gonna flop.......
@fahimhossain8959,2024-08-17T18:59:11Z,2024-08-17T18:59:11Z,0,He&#39;s the most intelligent beast.
@Billy_Lenz,2024-08-17T18:38:28Z,2024-08-17T18:38:28Z,0,This looks like the new Hellboy movie.
@Bedavere,2024-08-17T18:33:16Z,2024-08-17T18:33:16Z,0,Really like the idea of Kraven but this seems so low quality.
@JogiHarryNath13,2024-08-17T18:32:52Z,2024-08-17T18:32:52Z,0,Why i forget this 😂
@ciiil8802,2024-08-17T18:11:51Z,2024-08-17T18:11:51Z,0,Can&#39;t wait for kraven to say im the hunter
@morbiddad994,2024-08-17T18:09:10Z,2024-08-17T18:09:10Z,0,BRO IVE BEEN A RHINO FAN SINCE 7 YEARS OLD I AM TOO HYPED FOR HIM
@JaniceCarter-ws7lu,2024-08-17T17:42:15Z,2024-08-17T17:42:15Z,0,When the man comes around😁<br><br>This looks Good
@Mannymannndaghoostttt,2024-08-17T17:34:25Z,2024-08-17T17:34:25Z,0,"Guys, I think the man is coming around😳"
@deamon1982,2024-08-17T17:26:44Z,2024-08-17T17:26:44Z,0,That Rhino looks terrible.
@Klowqa,2024-08-17T16:58:14Z,2024-08-17T16:58:14Z,0,Here to deslike😂😊
@DavidW.WardJR,2024-08-17T16:55:27Z,2024-08-17T16:55:27Z,0,They play another full song that has lyrics during the trailer like they did with the Venom The Last Dance trailer.
@DavidW.WardJR,2024-08-17T16:54:33Z,2024-08-17T16:54:33Z,0,"The hairs will stand up on your arm, Spider-Man."
@DavidW.WardJR,2024-08-17T16:52:57Z,2024-08-17T16:52:57Z,0,Russell Crowe opening the trailer with &quot;My son&quot;; he wants to be just like Marlon Brando as Jor-El
@skwoons,2024-08-17T16:47:16Z,2024-08-17T16:47:16Z,0,does every trailer have echoey old remixed music now
@coquinha3074,2024-08-17T16:41:28Z,2024-08-17T16:41:28Z,0,i really hope he gets the symbiote like in the comics
@JohnCoates-l9j,2024-08-17T16:35:42Z,2024-08-17T16:35:42Z,1,I saw this being filmed
@Irakli_Kobakhidze,2024-08-17T16:33:21Z,2024-08-17T16:33:21Z,1,Its kravenin time!!
@jamaldaniels5542,2024-08-17T16:32:56Z,2024-08-17T16:32:56Z,0,"I don&#39;t think Johnny Cash was the right song to set the tone... the character&#39;s true name is Sergei and he is a Russian born boy who grows up in Russia before gaining these extraordinary powers years later. Should have had a much more eerie &amp; unfamiliar &quot;Cold War&quot;-kinda vibe to his origins, rather than Johnny Cash playing in the background with the tropical Congo setting.<br><br>I just don&#39;t like the melding of the two, when it&#39;s so out of place.<br>🤷‍♂"
@SuperProGamer255,2024-08-17T16:15:47Z,2024-08-17T16:15:47Z,0,i thought this was going to be a tv show
@Ivan162342,2024-08-17T15:45:44Z,2024-08-17T15:45:44Z,0,Stupid movies without the most important character to develop the villains.
@jkbawlson391,2024-08-17T15:43:40Z,2024-08-17T15:43:40Z,3,"I need that version of Kraven from the Spider-Man 2 game, “BRING IT OUT”!!! Show that true nature that Kraven represents"
@jdmtc5,2024-08-17T15:29:46Z,2024-08-17T15:29:46Z,0,I feel the trailer was the movie.  I get the same vibes a Morbius movie = POS
@rohambahraee,2024-08-17T15:26:00Z,2024-08-17T15:26:00Z,0,"I know the movie&#39;s name is When A Man Comes Around, what&#39;s the name of the music?"
@slyme369,2024-08-17T15:23:49Z,2024-08-17T15:23:49Z,0,Ok...but why?
@RicklessSanchez,2024-08-17T15:23:13Z,2024-08-17T15:23:13Z,0,I hope this is Spider man tobey maguire universe.
@MegaEcan,2024-08-17T15:19:23Z,2024-08-17T15:19:23Z,0,i am Kraving
@BennyStansell,2024-08-17T15:09:58Z,2024-08-17T15:09:58Z,0,"<a href=""https://www.youtube.com/watch?v=I8gFw4-2RBM&amp;t=137"">2:17</a> KRAVEN THE HUNTER<br>RATED R<br>ONLY IN THEATERS FRIDAY THE 13TH OF DECEMBER (DECEMBER 13)"
@SINISTERfromHELL,2024-08-17T15:07:17Z,2024-08-17T15:07:17Z,0,Why does Hollywood insist on using russian language when 98% of the time it&#39;s cringe?
@avoterz123,2024-08-17T15:05:45Z,2024-08-17T15:05:45Z,0,What the hell is the premise of this story?
@VinPal99,2024-08-17T14:55:20Z,2024-08-17T14:55:20Z,0,This movie better be good. All the other SSU movies except venom were garbage
@Zackerath,2024-08-17T14:46:52Z,2024-08-17T14:46:52Z,0,Already bored.
@Honestmairda,2024-08-17T14:46:45Z,2024-08-17T14:46:45Z,0,"The Rhinos Design reminds me of the Lizards Design in Tasm 1, Almost Perfect, But the Face Ruins it"
@mrtomorrowman1,2024-08-17T14:39:26Z,2024-08-17T14:39:26Z,0,So villains heroes now?
@susieast450,2024-08-17T14:16:39Z,2024-08-17T14:16:39Z,0,December?!?! I thought it was supposed to be in theaters at the end of the month 😢😢
@KarimSP14,2024-08-17T14:14:49Z,2024-08-17T14:16:09Z,0,So Zeus has another son
@BleedingSirensOfficial,2024-08-17T14:05:10Z,2024-08-17T14:05:10Z,0,about to make a kravenmillion
@mikebenoit13,2024-08-17T14:02:29Z,2024-08-17T14:02:29Z,0,Hopefully marvel can stick to this style and pull itself from the bowls of LGBT
@KenMilliam,2024-08-17T13:49:16Z,2024-08-17T13:49:16Z,0,Zeus and quicksilver lol
@KenMilliam,2024-08-17T13:48:35Z,2024-08-17T13:48:35Z,0,Is he quicksilver?
@pressx4ent,2024-08-17T13:38:20Z,2024-08-17T13:38:20Z,0,Looks like hot garbage
@mattymacd4179,2024-08-17T13:21:56Z,2024-08-17T13:21:56Z,0,Been Kraven for a movie like this one :D<br><br><br>Hope it exceeds Morbius :O
@kidpiper9642,2024-08-17T13:14:35Z,2024-08-17T13:14:35Z,0,This guy doesn&#39;t have the look I was expecting. Almost everyone that played Kano in any Mortal Kombat is more what I was hoping for.
@tompcfrog,2024-08-17T12:51:20Z,2024-08-17T12:51:20Z,0,&#39;Ngl Really Kraven a hunt rn&#39;<br>- Quicksilver
@4tc4,2024-08-17T12:49:08Z,2024-08-17T12:49:08Z,0,I have high hopes
@SUN.SCREEN.TASTE.LIKE.SUMMER,2024-08-17T12:42:29Z,2024-08-17T12:42:29Z,0,So someone thought it was cool to ruin a jonny cash song like this and put it to some stupid B movie who ever did that should be fired because no one is gonna watch this because of it.
@WhatUpRob,2024-08-17T12:33:55Z,2024-08-17T12:33:55Z,0,"Sony, just give up."
@EntertainmentBuzz9,2024-08-17T12:25:59Z,2024-08-17T12:25:59Z,0,I hope it&#39;s crazy as it seems here
@meep9963,2024-08-17T11:50:13Z,2024-08-17T11:50:13Z,0,John wick after story
@KlyntarNage666,2024-08-17T11:37:41Z,2024-08-17T11:37:41Z,0,Actually not bad
@megamegaO,2024-08-17T11:10:57Z,2024-08-17T11:10:57Z,0,&quot;It&#39;s KRAVEN time!!&quot;
@sking7448,2024-08-17T11:04:15Z,2024-08-17T11:04:15Z,0,This is going to be epic. Cant wait to watch his story
@deki5616,2024-08-17T11:03:13Z,2024-08-17T11:03:13Z,0,Dude runs like he was quicksilver
@Yesreaditloud,2024-08-17T10:44:34Z,2024-08-17T10:44:34Z,3,"When I saw Aron Taylor playing the character of Wanda&#39;s brother Pietro Maximoff, I believe that was not worthy at all playing this character after Marvel quickly killed him in the end, After Watching the performance of Aaron in Bullet Train, This is The Perfect Casting of Aaron playing kraven."
@capitalb2431,2024-08-17T10:31:41Z,2024-08-17T10:31:41Z,0,I’m still not sure about this movie
@buddylove2073,2024-08-17T10:19:16Z,2024-08-17T10:19:16Z,0,"The hunt for Spider-Man and the relationship with his brother, the master spy Chameleon was what defined Kraven in the comics. Not sure what narrative they&#39;re going for here but let&#39;s hope it&#39;s good."
@Fhhhfffg-f4e,2024-08-17T10:02:49Z,2024-08-17T10:02:49Z,0,God is gone because many people throw $10 but Sony doesn’t make Sinister six
@Fhhhfffg-f4e,2024-08-17T10:01:07Z,2024-08-17T10:01:07Z,0,Where is moonknight? Sony should pick up unpopular useful Character from Disney
@vidomore6774,2024-08-17T09:55:09Z,2024-08-17T09:55:09Z,0,What a trailer
@Prengue,2024-08-17T09:49:12Z,2024-08-17T09:49:12Z,0,either gonna be like moon knight or another near disappointment like echo
@michaelkearney1955,2024-08-17T09:22:31Z,2024-08-17T09:22:31Z,0,Is his not a big small to play kraven 😅
@tl5957,2024-08-17T09:10:53Z,2024-08-17T09:10:53Z,0,"Yuri Boyka (Scott Adkins) Is a Better interpretation of Kraven The Hunter, &amp; that wasnt even the role he was Playing 😂😂 ... if you seen Undisputed 2 then you know what I&#39;m talking about 😂"
@pbdan1473,2024-08-17T08:53:55Z,2024-08-17T08:53:55Z,0,So Sony finally listened to the fans and made an R rated character movie that&#39;s actually rated R. But still somehow looks trash. Just sell the Spiderman rights back to marvel Sony. Y&#39;all clearly don&#39;t know what you&#39;re doing.
@p-kpp110,2024-08-17T08:36:36Z,2024-08-17T08:36:36Z,0,JOHNNY CASH
@walterdomine,2024-08-17T07:43:10Z,2024-08-17T07:43:10Z,0,This trailer really made me understand there was a man coming around
@hoopoverthehill,2024-08-17T07:31:09Z,2024-08-17T07:31:09Z,0,It actually doesn&#39;t look awful. Might go see after all.
@deeproject167,2024-08-17T07:18:55Z,2024-08-17T07:18:55Z,0,finally worthy rhino to watch
@kursedmilk,2024-08-17T07:14:42Z,2024-08-17T07:14:42Z,0,When the MAN comes around
@MrLobo1024,2024-08-17T06:44:46Z,2024-08-17T06:44:46Z,0,"Scott Adkins would&#39;ve been an cool Kraven, just look at him in Undisputed films."
@DannyDiablo1013,2024-08-17T06:40:27Z,2024-08-17T06:40:27Z,0,Couldn&#39;t find any bigger Australians?   Or just bigger deeper voice guys.    Hell Jason mamoa
@MrLobo1024,2024-08-17T06:40:04Z,2024-08-17T06:40:04Z,0,"Yeah, yeah i know Quicksilver is Kraven the hunter in the Marvel multi-universe."
@Weirdopiersoon,2024-08-17T06:34:09Z,2024-08-17T06:34:09Z,0,Nah wtf you guys do to rhino💀 mfs turned him into Russian green goblin
@johntitor3198,2024-08-17T06:33:37Z,2024-08-17T06:33:37Z,0,Morbin Time
@PanDeism,2024-08-17T06:31:58Z,2024-08-17T06:31:58Z,0,Well that was violent.
@revelationglitch,2024-08-17T06:04:32Z,2024-08-17T06:04:32Z,0,another cringe movie
@BrainBoostNinja,2024-08-17T06:00:46Z,2024-08-17T06:00:46Z,2972,This is going to be one of the movies of all time! I can&#39;t wait for the main character to say &#39;It&#39;s Kravenin time&#39; and hunt all over the place. Literal chills!
@kojiyaw,2024-08-17T05:59:51Z,2024-08-17T05:59:51Z,142,&quot;I am Kraven. Kraven Somdic.&quot;<br><br>Gotta be the hardest line of all fr 🔥🔥
@wm69,2024-08-17T05:53:01Z,2024-08-17T05:53:01Z,0,release the KRAVEN!!!
@shed117,2024-08-17T05:30:57Z,2024-08-17T05:30:57Z,0,The logic in making this film = $🤡🙃
@shed117,2024-08-17T05:27:59Z,2024-08-17T05:27:59Z,0,Who seriously WHO asked for this?
@shinndig1293,2024-08-17T05:27:37Z,2024-08-17T05:27:37Z,5,"<a href=""https://www.youtube.com/watch?v=I8gFw4-2RBM&amp;t=132"">2:12</a> &quot;...And you will become a wetsuit&quot;"
@shed117,2024-08-17T05:25:07Z,2024-08-17T05:25:07Z,0,Why and WHY ?....<br>🤡🙃
@DanielHernandez-d9s,2024-08-17T05:24:38Z,2024-08-17T05:24:38Z,2,Imma only watch this because he&#39;s a good actor
@KarKarBinks,2024-08-17T05:23:56Z,2024-08-17T05:23:56Z,0,I cant wait for the scene when all the characters bond over their tramas and learn CPR to save Kraven
@KarKarBinks,2024-08-17T05:22:16Z,2024-08-17T05:22:16Z,0,How did that dude miss shooting Kraven when homie was on all fours?
@hinney827,2024-08-17T05:16:32Z,2024-08-17T05:16:32Z,1,So Kraven is Zeus&#39;s son now?<br><br>Or are we just ignoring Thor again?
@walkintobrickwallsfordays8756,2024-08-17T05:02:37Z,2024-08-17T05:02:37Z,0,Cant wait for kraven to be so much a failure hes never used agian
@alexbrettw,2024-08-17T04:45:31Z,2024-08-17T04:45:31Z,33,I love when Zeus says “Release the Kraven”
@ianlumacad6672,2024-08-17T04:43:53Z,2024-08-17T04:43:53Z,0,another trailer is better than the actual movie? ... let&#39;s find out 😂😂
@complex2live,2024-08-17T04:25:03Z,2024-08-17T04:25:03Z,0,This actually looks kind of cool
