author,published_at,updated_at,like_count,text
@gregyance9901,2024-08-15T19:10:47Z,2024-08-15T19:10:47Z,0,"No inclusive crap, no dumb comedy , make Marvel Movies great again, stop the bullsh.. let spiderman grow up and face Venom, Kraven, etc ,  WE the fans are sick watching Peter going back to high school , over and over and over again, let spideman be SpiderMAN , not little Spiderpetey and his young pals like the last movies"
@AlexHolmes.,2024-08-15T19:10:43Z,2024-08-15T19:10:43Z,0,My favourite part is when he said “time to Krave the Hunter known as Kraven the Hunter! It’s me I’m him! I’m the Kraven man!”
@JackOfNone97,2024-08-15T19:06:10Z,2024-08-15T19:06:10Z,0,Really? You released this trailer before the daredevil born again one? This just looks like less entertaining morbius. At least that was so bad it was funny
@RussianJackal,2024-08-15T19:05:54Z,2024-08-15T19:05:54Z,0,A goofy character that was actually done justice in the recent “spider man 2” game. This is just objectively terrible.
@hectordc007,2024-08-15T19:01:07Z,2024-08-15T19:01:07Z,0,"Nope. Can&#39;t trust y&#39;all after Venom 2, Madame Web &amp; Morbius."
@YuaraMeyzing,2024-08-15T19:00:20Z,2024-08-15T19:00:20Z,0,It&#39;s Rhyno
@Mick-014,2024-08-15T18:59:54Z,2024-08-15T18:59:54Z,0,I honestly thought this movie took place in the same universe as Andrew Garfield’s movies but bc of rhino being and actual rhino (just on steroids) I am confused
@LisaAmanda18,2024-08-15T18:56:46Z,2024-08-15T18:56:46Z,0,"This dude’s name is Kraven and he is indeed a hunter. So far, so good. Looks like Sony’s done it again!"
@phothewin6019,2024-08-15T18:53:42Z,2024-08-15T18:53:42Z,1,They&#39;re trying to copy Logan with the Johnny Cash lol.
@risingabovetheoccasion,2024-08-15T18:50:16Z,2024-08-15T18:50:16Z,0,Finally made their way into the Rated R scene after deadpool made a billion dollars in 3 weeks lmao
@ThisIsMyFullName,2024-08-15T18:49:08Z,2024-08-25T18:20:24Z,0,Don&#39;t show all the highlights in the film jeez.
@burneyboys02,2024-08-15T18:48:02Z,2024-08-15T18:48:02Z,0,This trailer was way better than the first one.
@Shadowmoses616,2024-08-15T18:45:21Z,2024-08-15T18:45:21Z,0,"They ruined venom, they ruined morbius, let’s not talk about madam web, now kraven. Just put spiderman in it ffs."
@giovannyc3886,2024-08-15T18:43:12Z,2024-08-15T18:43:12Z,0,Kraven vs Rhino umm who comes up with these?
@BlazeInfiltrator,2024-08-15T18:43:04Z,2024-08-15T18:43:04Z,0,Wow😮
@mayormars5135,2024-08-15T18:42:10Z,2024-08-15T18:42:10Z,0,edgy: the trailer
@reddzedd,2024-08-15T18:36:29Z,2024-08-15T18:36:29Z,0,He seems a little too small.
@crayonhead555,2024-08-15T18:33:00Z,2024-08-15T18:33:00Z,0,This looks terrible why did they do this?
@RShorts17,2024-08-15T18:32:54Z,2024-08-15T18:32:54Z,0,so he got reincarnated as a wild beast from being a speedy runner?
@jimmy38977,2024-08-15T18:32:17Z,2024-08-15T18:32:17Z,0,feels like a bollywood movie title
@amongusus8156,2024-08-15T18:31:16Z,2024-08-15T18:31:16Z,0,Русский язык блять нормально не умею говорить 😂😂😂😂😂😂😂😂😂😂😂😂😂😂😂😂😂😂😂😂😂😂😂
@josuemartinez6865,2024-08-15T18:30:49Z,2024-08-15T18:30:49Z,0,Can’t wait for kraven to say <br><br>It’s Kravin time 😎
@icedarcade218,2024-08-15T18:30:09Z,2024-08-15T18:30:09Z,0,Sony&#39;d
@satwikgaur,2024-08-15T18:28:16Z,2024-08-15T18:28:16Z,0,Yeah show the whole movie in the trailer 🎉
@Andre-vt4np,2024-08-15T18:24:12Z,2024-08-15T18:24:12Z,0,Cant wait till some generic bad guy says &quot;Its him! Its Kravin the Hunter&quot;
@goodguyindeed,2024-08-15T18:21:07Z,2024-08-15T18:21:07Z,0,why is this so boring
@AJ_1999,2024-08-15T18:19:55Z,2024-08-15T18:19:55Z,227,Madame Web <br>“Finally a worthy opponent! Our battle will be legendary!!”
@Andre-vt4np,2024-08-15T18:18:21Z,2024-08-15T18:18:21Z,0,Ahh yes the ol&#39; put Lion blood droplet to get animal powers
@lumalah9144,2024-08-15T18:17:23Z,2024-08-15T18:17:23Z,2,Bro where’s Morbius? This movies gonna suck without and with him :(
@zombiehedgehog98,2024-08-15T18:12:54Z,2024-08-15T18:12:54Z,0,They&#39;re hunters guys
@Nbbrill10,2024-08-15T18:04:52Z,2024-08-15T18:04:52Z,0,Y tho. There’s no Spider-Man
@andrewdenny7827,2024-08-15T18:03:53Z,2024-08-15T18:03:53Z,0,A proper looking rhino.  Who ever came up with the rhino for amazing spider man 2 hopefully have been fired.
@BotsandMagic,2024-08-15T18:03:47Z,2024-08-15T18:03:47Z,0,Madam Web 2.0
@Nachosaurio167,2024-08-15T18:02:50Z,2024-08-15T18:02:50Z,0,"I apologise Paul Giamatti, maybe we treated you too harshly"
@Atelier-Re,2024-08-15T18:00:43Z,2024-08-15T18:00:43Z,0,i hear russel crowe...im instantly all in! cant wait to watch ATJ and Russel Crowe in a movie together!
@niarche,2024-08-15T17:59:11Z,2024-08-15T17:59:11Z,0,이 예고편이 다는 아니겠죠? 내용 재밌겠..죠?
@wilfredoespinovargas7705,2024-08-15T17:58:16Z,2024-08-15T17:58:16Z,0,Entonces Zeus es el padre de Kraven?!! 🤯
@D_Andrew_G,2024-08-15T17:57:24Z,2024-08-15T17:57:24Z,0,“I was in the wilderness researching rhinos”
@arnold20139,2024-08-15T17:56:39Z,2024-08-15T17:56:39Z,0,"At this point Sony, just let Disney have the rest of Marvel. Its gonna happen soon enough."
@harshpathak7774,2024-08-15T17:52:27Z,2024-08-15T17:52:27Z,0,Feels like jhon wick and punisher came together
@jayrocketfella,2024-08-15T17:49:17Z,2024-08-15T17:49:17Z,0,Is that Pollux Troy ???? 😅
@faithfullylinto3688,2024-08-15T17:46:47Z,2024-08-15T17:46:47Z,0,The future 007 🔥🔥
@sferris33,2024-08-15T17:41:52Z,2024-08-15T17:41:52Z,0,This is what Marvel should do with Dr Doom.  Make a standalone movie to develop his origins and the character!
@mmuallim4293,2024-08-15T17:38:14Z,2024-08-15T17:38:14Z,0,He looks like quicksilver in avengers age of ultron
@spider-jonah-man7148,2024-08-15T17:35:45Z,2024-08-15T17:35:45Z,1,Why is the official marvel channel promoting Sony’s slop?😂
@abhijithksonline,2024-08-15T17:34:38Z,2024-08-15T17:34:38Z,1,So what is his Super Power ?
@JayRules,2024-08-15T17:31:33Z,2024-08-15T17:31:33Z,0,Are you sure he&#39;s a hunter because I thought he is a breakdancer like the legend Ray Gun
@edit_mpror,2024-08-15T17:29:14Z,2024-08-15T17:29:14Z,0,Sony trailer ☠️🗿 actual movies 🤡
@amplexorj,2024-08-15T17:26:34Z,2024-08-15T17:26:34Z,0,It&#39;s Kravin&#39; Time!
@HorseJoint,2024-08-15T17:25:29Z,2024-08-15T17:26:09Z,0,"The gratuitous Violence might make this movie worth watching frfr. And say what you will about “Aaron Taylor Johnson”, but I actually like every role he’s in. He just needs BETTER roles is all. He’s a really great actor. Imma go see it🤷🏾‍♂️"
@asabatonlessarmour4372,2024-08-15T17:18:23Z,2024-08-15T17:18:23Z,0,Can&#39;t believe they would release the whole movie on youtube like this
@C-Murdaa777,2024-08-15T17:13:54Z,2024-08-15T17:13:54Z,0,This actually looks pretty good
@BlueRedPurple13,2024-08-15T17:07:05Z,2024-08-15T17:07:05Z,0,No Spider man is so stupid
@VINxSHOW,2024-08-15T17:06:29Z,2024-08-15T17:06:29Z,0,Another Spiderman character movie without Spiderman itself <br><br>Nice plan sony
@Elros04,2024-08-15T17:03:25Z,2024-08-15T17:03:25Z,0,"i feel bad for the actor, he actually looks the part... but the movie is going to bomb..."
@danpage6907,2024-08-15T17:02:09Z,2024-08-15T17:02:09Z,2,"I&#39;m having difficulty imagining the agents of the decent/recognizable/good actors in this movie who approached their clients <b>after</b> Venom: Let There Be Carnage, Morbius, and Madame Web had been filmed and/or released and said to them &quot;Sony has a great opportunity for you in their next &#39;Spiderman Villains&#39; movie....&quot;"
@mbtoober,2024-08-15T17:00:13Z,2024-08-15T17:00:13Z,0,"Russell Crowe in Superman, Thor, Kraven : My Son, The Popes Exorcist: My Nun&#39;, L.A. Confidential, &amp; The Nice Guys: My Gun."
@kushyskywalkr_yt1732,2024-08-15T16:59:24Z,2024-08-15T16:59:24Z,0,So milk what you can until it goes back to Marvel ! Got it!
@zedospicos6571,2024-08-15T16:51:42Z,2024-08-15T16:51:42Z,0,The only thing saving this movie is when Kraven says &quot;It&#39;s kravin time&quot;
@FukigenBelt,2024-08-15T16:51:40Z,2024-08-15T16:51:40Z,0,If I was a Kraven fan I’d probably be at least happy for the spotlight on the character but I’ve never understood why so many people have him as their favorite Spider-Man villain
@casualsurfing4428,2024-08-15T16:51:39Z,2024-08-15T16:51:39Z,0,"From the studio that brought us Morbius and Mad. Web, this looks SHOCKINGLY OK! Not great, but fine. That is a huge step up... I can&#39;t believe I&#39;m praising Sony for making a semi-decent trailer, lmfao"
@sudeepsarkar3320,2024-08-15T16:47:59Z,2024-08-15T16:47:59Z,1,WHEN THE MAN COMES AROUND
@Bigjojo173,2024-08-15T16:47:47Z,2024-08-15T16:47:47Z,0,Its kraven time!!
@derekgonzalez938,2024-08-15T16:43:24Z,2024-08-15T16:43:24Z,0,"I liked the part where Morbius come out and says, “It’s Morbin time”"
@mr.heckercodm4493,2024-08-15T16:38:47Z,2024-08-15T16:38:47Z,0,Where are you going with this sony ?
@kai69wtf,2024-08-15T16:38:00Z,2024-08-15T16:38:00Z,0,i literally had to check the calendar if it was April 💀🙏
@jpmartinez9165,2024-08-15T16:37:37Z,2024-08-15T16:37:37Z,0,Looks awful
@3eyedprophet,2024-08-15T16:36:38Z,2024-08-15T16:36:38Z,0,Aye tho let them cook a comeback takes time let’s be real
@sammywaddell,2024-08-15T16:31:10Z,2024-08-15T16:31:10Z,0,Looks cool but i don’t understand what the plot is supposed to be about lol
@Avanttikaslyf,2024-08-15T16:27:45Z,2024-08-15T16:27:45Z,0,Either you die as quiksilver in MCU or return as some random superhero who&#39;s heavily nerfed by sony 🤡🤡🤡🤡🤡
@AayushmaanDogra,2024-08-15T16:27:17Z,2024-08-15T16:27:17Z,0,Kraven fighting Rihno is just one bad guy less for Peter.
@cool3dd,2024-08-15T16:27:04Z,2024-08-15T16:27:04Z,0,Sony were gonna make a Kraven movie <br>Kraven movie = kraven the hitman 😅
@KomradeKrusher,2024-08-15T16:26:59Z,2024-08-15T16:26:59Z,3,"It takes a special kind of talent to make a Johnny Cash song unlistenable to. Thanks a bunch, Sony Pictures."
@jimboswamps5602,2024-08-15T16:26:50Z,2024-08-15T16:26:50Z,0,"Now they are doing it with Kraven. They are a special kind of loser, one that LIVES online. Go outside, get a girlfriend, move out of mommy&#39;s house, big guys."
@prtski6621,2024-08-15T16:23:06Z,2024-08-15T16:23:06Z,0,"push so hard for Sony., nice try."
@TheRealSyckflo,2024-08-15T16:20:35Z,2024-08-15T16:20:35Z,1,"Comic accurate Rhino is awesome, but I&#39;m not going to risk paying to watch a 2 hour lackluster movie for one cool fight scene."
@AlanQSmithee,2024-08-15T16:19:38Z,2024-08-15T16:19:38Z,0,I like the part where he says &quot;It&#39;s hunterin&#39; time&quot; and starts hunting
@frostgamez9368,2024-08-15T16:17:12Z,2024-08-15T16:17:12Z,0,This does actually look pretty good but Sony do just need to hand over all Spider-Man rights to Marvel now
@middleman5484,2024-08-15T16:13:36Z,2024-08-15T16:13:36Z,0,"This is definitely better than the first trailer, and I can’t wait to see what this film has in store"
@chrislunsford5161,2024-08-15T16:12:09Z,2024-08-15T16:12:09Z,0,Poopie
@RAMArtAndMedia,2024-08-15T16:07:12Z,2024-08-15T16:07:12Z,17,Quicksilver went through puberty.
@AzharAli-ho4mz,2024-08-15T16:06:03Z,2024-08-15T16:06:03Z,0,So it will be crossover with venom3?
@antoniacosta6221,2024-08-15T16:04:49Z,2024-08-15T16:04:49Z,1,I just wanna know why they edited Kraven stabbing the prisoner in his neck into replaying 3 different times from 3 different angles
@TheStevenHHC,2024-08-15T15:53:43Z,2024-08-15T15:53:43Z,0,Can&#39;t wait for this movie to flop
@BloxdDreamYT,2024-08-15T15:53:10Z,2024-08-15T15:53:10Z,0,Please put Spider-Man in this
@alexhuhn231,2024-08-15T15:52:26Z,2024-08-15T15:52:26Z,1,Has Quicksilver become a Sergei Kravinoff? What do we know about the multiverse?😂
@lilliemoore93,2024-08-15T15:51:00Z,2024-08-15T15:51:00Z,1,From Pietro Maximoff to Kraven
@dieisonbasso2496,2024-08-15T15:50:40Z,2024-08-15T15:50:40Z,0,sony marketing in marvel?????????????
@opgaming-me4iu,2024-08-15T15:47:36Z,2024-08-15T15:47:36Z,0,It&#39;s kravin time baby ❤
@CLINTTHECOOL,2024-08-15T15:45:01Z,2024-08-15T15:45:01Z,0,When the man comes around <br>When the man comes around<br>When the man comes around <br>When the man comes around <br>When the man comes around<br>When the man comes around When the man comes around <br>When the man comes around<br>When the man comes around When the man comes around <br>When the man comes around<br>When the man comes around When the man comes around <br>When the man comes around<br>When the man comes around
@dandida84,2024-08-15T15:41:18Z,2024-08-15T15:41:18Z,0,Hahaha this is gonna be such a bad film!!! Why are Sony even trying anymore?
@PedroCampos-r1j,2024-08-15T15:35:15Z,2024-08-15T15:35:15Z,0,Vinihlnia bilmnvcho vinicyalo.
@emchamberlain,2024-08-15T15:35:06Z,2024-08-15T15:35:06Z,0,Its Kravening TIme.
@3000cbreezy,2024-08-15T15:34:26Z,2024-08-15T15:34:26Z,1,"This movie doesn’t look THAT bad, im gonna give it a shot….I think Aaron Taylor could be a great Kraven if they show him right👌🏾"
@EthanWallaceYT,2024-08-15T15:30:32Z,2024-08-15T15:30:32Z,0,Wasted potential. He could&#39;ve been the next Captain America—I can see it. 😞🇺🇲
@striveprosper295,2024-08-15T15:28:42Z,2024-08-15T15:28:42Z,1,Looks 🔥🔥🔥
@faryalaziz,2024-08-15T15:26:29Z,2024-08-15T15:26:29Z,0,Well he&#39;s reincarnated as Kraven in marvel after he died as quicksilver lol 😂😆
@lolganrox_12katsu30nichi,2024-08-15T15:21:41Z,2024-08-15T15:21:41Z,0,Betting that this movie will bring down the entire SSU if it flops
@DmDaPDm,2024-08-15T15:17:41Z,2024-08-15T15:17:41Z,1,"I can&#39;t lie, That was a pretty good trailer, so far its looking like the best directed film of the sony spiderman villians"
@rainingsilverz4422,2024-08-15T15:16:01Z,2024-08-15T15:16:01Z,1,Idk about you guys but I’m hella excited for this! 🔥🔥🔥💪💪
@Fourquartercarpentry,2024-08-15T15:14:10Z,2024-08-15T15:14:10Z,0,Ooooh look at all the blood this is so edgy
@samboythekingzeldo2,2024-08-15T15:10:30Z,2024-08-15T15:10:30Z,0,this looks promising
@wawaluiz641,2024-08-15T15:10:03Z,2024-08-15T15:10:03Z,0,This Rhino is in apparition in No Way Home with portal univers easteregg ? ;)
@eliek2014,2024-08-15T15:08:47Z,2024-08-15T15:08:57Z,0,What&#39;s with all these tiny men playing physically imposing characters. Kravrnnif crafty and powerful.
@Mike_Spina,2024-08-15T15:05:08Z,2024-08-15T15:05:08Z,0,spider man villain movie without spiderman........................
@cityofevil713,2024-08-15T14:59:33Z,2024-08-15T14:59:33Z,0,Movie is gonna flop more than lebron
@whatthehell1447,2024-08-15T14:53:55Z,2024-08-15T14:53:55Z,0,Die in heroes(quicksilver) rise to the villian(kraven the hunter)🗿
@renatolfig,2024-08-15T14:51:45Z,2024-08-15T14:51:45Z,0,This is Sony looking at Deadpool and thinking the reason it was successful it was just the R Rating and the violence
@hydro6039,2024-08-15T14:49:49Z,2024-08-15T14:49:49Z,0,Johnny cash knows how to hype a movie up
@questionmark6309,2024-08-15T14:48:53Z,2024-08-15T14:48:53Z,0,Sony released this trailer 1 year earlier
@saitejeshwar2937,2024-08-15T14:46:43Z,2024-08-15T14:46:43Z,1,This is the kind of marvel movies we want to see.
@Spawn1234,2024-08-15T14:45:03Z,2024-08-15T14:45:03Z,0,A whole day and only 800000 views? Bro that’s bad
@Spacecrust,2024-08-15T14:34:16Z,2024-08-15T14:34:16Z,0,ITS MORBIN&#39; TIME!
@eternalproductions,2024-08-15T14:33:57Z,2024-08-15T14:33:57Z,68,I got chills when he said &quot; I&#39;m gonna start craving soon ...you won&#39;t like me when im Kravin &quot; absolute masterpiece
@thunderpantz,2024-08-15T14:33:41Z,2024-08-15T14:33:41Z,0,They have some fuzzy dice to use Johnny Cash for this.
@eternalproductions,2024-08-15T14:33:17Z,2024-08-15T14:33:17Z,415,I got chills when he said &quot; I&#39;m gonna start craving soon ...you won&#39;t like me when im Kravin &quot; absolute masterclass
@baba_treesh,2024-08-15T14:31:31Z,2024-08-15T14:31:31Z,0,Am I the only one who feels like this movie is kinda a waste when they could be making a Spider-Man movie with kraven as the villain but getting a solo movie of him is just like WTF why?
@christopherfascenelli2454,2024-08-15T14:21:36Z,2024-08-15T14:21:36Z,0,From the look of this trailer... I have no idea what the plot is.
@rlacksgh9673,2024-08-15T14:15:44Z,2024-08-15T14:15:44Z,0,"I just came to see the comments, and it does not disappoint"
@harleykeener598,2024-08-15T14:13:36Z,2024-08-15T14:13:36Z,0,"Dear Marvel/Sony, you gotta change the Rhino, man..."
@m16chi,2024-08-15T14:10:06Z,2024-08-15T14:10:06Z,0,I wish Sony would give Marvel back its stuff now
@Dreamyourcomment,2024-08-15T14:10:04Z,2024-08-15T14:10:04Z,0,is this movie related to the &quot;I think it has something to do with Spiderman&quot; universe?
@jesseburgener442,2024-08-15T14:07:32Z,2024-08-15T14:07:32Z,0,Did anyone else watch this hoping for Madame Web/Morbius levels of meme material only to walk away disappointed?
@ollihro82,2024-08-15T14:07:03Z,2024-08-15T14:07:03Z,0,dude is too small ... and not interesting enough without fighting spiderman in my eyes.
@FrankNadarStudios,2024-08-15T14:01:51Z,2024-08-15T14:01:51Z,0,Sony’s Kravings To Destroy Marvel’s IPs 😭
@michaelpelaez1979,2024-08-15T14:01:08Z,2024-08-15T14:01:08Z,0,"So if The Rhino is Kraven&#39;s enemy/ villain, then wouldn&#39;t Spider-Man say The Enemy of my enemy is my friend? Come on Rhino old buddy let&#39;s get that Kraven."
@denzyllayug3254,2024-08-15T14:00:07Z,2024-08-15T14:00:07Z,0,Finally a new marvel film that nothing to do with some mulitiversal bullshit
@AlikAkhm92,2024-08-15T13:59:37Z,2024-08-15T13:59:37Z,0,Чето слабовато
@TheUchihaCub,2024-08-15T13:59:08Z,2024-08-15T13:59:08Z,2,"I keep seeing people complain about Morb and Madam web not working but honestly-<br>Kraven is the only one who MIGHT work on his own cause he’d be more believable to a normal audience.<br>It’s easier to sell him than a vampire or madam web.<br>Venom only worked cause he’s so mainstream.<br>And this movie looks kinda fun, at least all the violence might make it watchable."
@youtubehandle86-p8i,2024-08-15T13:58:44Z,2024-08-15T13:58:44Z,0,♦️💯⁉️💔😍
@matrixlander85,2024-08-15T13:58:00Z,2024-08-15T13:58:00Z,0,This thing is destined to bomb!
@pitchblack4324,2024-08-15T13:57:17Z,2024-08-15T13:57:26Z,0,&quot;Its Kraven time&quot;
@mihawk7493,2024-08-15T13:52:25Z,2024-08-15T13:52:32Z,0,is Sony kraven different?
@nhoodjazz,2024-08-15T13:51:08Z,2024-08-15T13:51:08Z,0,Surprisingly look good
@aplacido37,2024-08-15T13:51:02Z,2024-08-15T13:51:02Z,0,Yesss!! I’m glad he’s a mutant rhino
@s.f7822,2024-08-15T13:49:01Z,2024-08-15T13:49:01Z,0,"Rhino, Kraven, morbius etc. but there is no spider-man? whats the point"
@GamingHangoutIndia,2024-08-15T13:47:52Z,2024-08-15T13:47:52Z,0,So basically Kravel is thr son of Marvel Zeus😅😅😅
@GamingHangoutIndia,2024-08-15T13:47:21Z,2024-08-15T13:47:21Z,0,I hope this doesn&#39;t repeat the Morbius apocalypse 😢😢😢😢😢
@jasonbishop5408,2024-08-15T13:47:00Z,2024-08-15T13:47:00Z,0,"Sony, please just stop. Please."
@siratulhaqueadib6022,2024-08-15T13:42:52Z,2024-08-15T13:42:52Z,0,Watching from Bangladesh 🇧🇩
@reptocilicus,2024-08-15T13:41:38Z,2024-08-15T13:41:38Z,0,“He was with my father when he was hunting lions in Africa right before he died.”
@Yeezus_Khrist,2024-08-15T13:35:32Z,2024-08-15T13:35:32Z,0,It’s kraving time!!!
@baddezgamer6462,2024-08-15T13:34:52Z,2024-08-15T13:34:52Z,0,THIS IS MARVEL !!!!!!!!!🤌🙌
@kshitijshimpukade6252,2024-08-15T13:30:14Z,2024-08-15T13:30:14Z,1,"Lets gooo can&#39;t wait to see a aunt may movie, ďr octopus movie, an electro movie...uncle bed would be the besttt...i think a mj and harry duo would be a great movie idea...pleasee sonyyy gives us thattt...we want to spiderman from u and are not even expectingg...keep uppp🔥🔥"
@edwinjoseph5504,2024-08-15T13:27:39Z,2024-08-15T13:27:39Z,0,It&#39;s Kraving time!!!
@giraffesauce4561,2024-08-15T13:24:04Z,2024-08-15T13:24:04Z,0,It’s kravenin time!
@Ambar42,2024-08-15T13:23:49Z,2024-08-15T13:23:49Z,0,This is definitely our next James Bond. Great application.
@user-wk5se5qq8l,2024-08-15T13:13:30Z,2024-08-15T13:13:30Z,0,"Remember madam web, morbius and this movie is next,"
@dmeme195,2024-08-15T13:03:36Z,2024-08-15T13:03:36Z,0,Aaron looks great but this trailer is very lackluster.
@Olddirtysouth11,2024-08-15T13:03:20Z,2024-08-15T13:03:20Z,0,Address the allegations Jimmy! ( Oops wrong video)
@fduatsanga984,2024-08-15T13:00:17Z,2024-08-15T13:00:17Z,0,Will we see white tigher
@joshmargolis1424,2024-08-15T12:56:41Z,2024-08-15T12:56:41Z,0,Arrow Season 1 the movie
@ZyzyxVile,2024-08-15T12:55:56Z,2024-08-15T12:55:56Z,0,"Sony, please stop making superhero films. Sincerely, the global population of Earth and the future generations of cringers to come."
@ryanwithacapitalb,2024-08-15T12:54:11Z,2024-08-15T12:54:11Z,0,Release the Kraven!
@djjohnson2006,2024-08-15T12:53:44Z,2024-08-15T12:53:44Z,0,Kraven Tangerine The Dude From Bullet Train
@clemerlontayaojr6515,2024-08-15T12:50:35Z,2024-08-15T12:50:35Z,0,dang! this one is fireeeee 🔥
@brahmagraphix2442,2024-08-15T12:44:23Z,2024-08-15T12:44:23Z,10,"This trailer looks good. But after the dogshit that was Venom 2, Morbius and Madam Webb, I have little faith in any of Sony&#39;s Marvel movies."
@Pusher514G,2024-08-15T12:41:21Z,2024-08-15T12:41:21Z,2,"This man turned a joke into a series with hope, despair, loss and hype. He deserves every bit of recognition he has and even beyond that"
@jasontodd6822,2024-08-15T12:38:06Z,2024-08-15T12:38:06Z,0,They make Kraven Rated R but not any of the Venom movies? Ok 🤣
@BEAThatesyou,2024-08-15T12:34:08Z,2024-08-15T12:34:08Z,0,I feel like Johnny Cash would absolutely love this if he&#39;d been alive to see it.
@bryanlozado2752,2024-08-15T12:31:19Z,2024-10-29T16:20:23Z,0,Whos wifh me? &quot;Kraven is Eating in theaters this holiday season&quot;. Let this know that Kraven the hunter Will Officially be a Holiday Movie
@Fellow_internet_surfer.08,2024-08-15T12:21:09Z,2024-08-15T12:21:09Z,0,Who the villain again?
@nandologia_,2024-08-15T12:18:45Z,2024-08-15T12:18:45Z,269,"I love how the song says &quot;I hear the noise of thunder&quot; and then, lo and behold, the noise of thunder is heard. Amazing storytelling/editing."
@87dkinn,2024-08-15T12:15:34Z,2024-08-15T12:15:34Z,0,They really fit the entire movie into a trailer. Wild
@parzival398,2024-08-15T12:15:08Z,2024-08-15T12:15:08Z,0,his father is Zeus?
@illidanisdead6924,2024-08-15T12:15:03Z,2024-08-15T12:15:03Z,53,"It&#39;s like hollywood has no clue about these characters they still think Tomb Raider is a hero who goes around rescuing treasure, in reality she goes around looting treasure for herself. Kraven is a villain, who loves hunting and taking trophies not some hero who hunts villains lol"
@tskmaster3837,2024-08-15T12:14:02Z,2024-08-15T12:14:02Z,1,"Here&#39;s a good idea for a movie: A villain centric movie where he hunts the hero, who we only ever see as some sort of monster. Kraven the Hunter hunting Spider-man.<br>This is not that movie... Why isn&#39;t it that movie?"
@S4IF616,2024-08-15T12:12:22Z,2024-08-15T12:12:22Z,0,This Lowkey looks boring af how tf they managed to make even the trailer boring 😭😭😭
@ShubhamAgarwal0076,2024-08-15T12:06:53Z,2024-08-15T12:06:53Z,0,Karven should be a guy more bulked up and jacked
@13abhijeetpayasi,2024-08-15T12:02:01Z,2024-08-15T12:02:01Z,1,Rhino 🦏 is most stupid among all spidy villian in comics but in movies he is shown powerful
@flashboy826,2024-08-15T11:59:59Z,2024-08-15T11:59:59Z,0,Everyone gonna watch the movie now just cuz Rhino is in it 😂
@gutmanlapd,2024-08-15T11:58:47Z,2024-08-15T11:58:47Z,0,The 3rd movie in the morbius maiden web saga
@null-0x,2024-08-15T11:57:52Z,2024-08-15T11:57:52Z,0,The Deep
@amars773,2024-08-15T11:57:47Z,2024-08-15T11:57:47Z,0,"First VEMON, than morbius , now kraven. I wonder which next spider-man villain going to get their on anti hero movie lol."
@Oak_Sindacco,2024-08-15T11:55:00Z,2024-08-15T11:55:00Z,1,"The Rhino?? What is this, a villian cinematic universe?"
@xongillespie2584,2024-08-15T11:53:25Z,2024-08-15T11:53:25Z,0,Sony is stepping up their game!
@pedrocampos691,2024-08-15T11:48:50Z,2024-08-15T11:48:50Z,0,The lord of The Smilodon.
@CriticalStories,2024-08-15T11:48:41Z,2024-08-15T11:48:41Z,0,"Wow! Another unbeatable person in the MCU. Such creativity, guys."
@yoyoyonasa,2024-08-15T11:48:02Z,2024-08-15T11:48:02Z,0,I will be honest it has a lot of potential. Seems to target also a mature audience 😮
@rohitcharles007,2024-08-15T11:47:14Z,2024-08-15T11:47:14Z,0,Super we want more and more marvel movies
@crishhh483,2024-08-15T11:46:39Z,2024-08-15T11:46:39Z,0,"<a href=""https://www.youtube.com/watch?v=I8gFw4-2RBM&amp;t=18"">0:18</a> epico dialogo :v"
@BKing007,2024-08-15T11:45:30Z,2024-08-15T11:45:30Z,0,Phew so much action in trailer
@EReelz,2024-08-15T11:44:47Z,2024-08-15T11:44:47Z,0,His father sounds more like Kraven than Kraven does lol
@JB0528,2024-08-15T11:42:19Z,2024-08-15T11:42:19Z,0,Trailer cut to try to make Kraven look like some kind of good guy. I was all set to pass until I saw Aleksei Sytsevich. Now I&#39;m in! Just as soon as it hits a streaming service I already subscribe to.
@thedashdriver3969,2024-08-15T11:41:23Z,2024-08-15T11:41:23Z,0,Kraven is the Deadpool of the SSEU
@savioursgzcreations_zw4198,2024-08-15T11:40:55Z,2024-08-15T11:40:55Z,0,🎉
@pedrocampos691,2024-08-15T11:37:58Z,2024-08-15T11:37:58Z,0,Bow.
