author,published_at,updated_at,like_count,text
@johnnycage5481,2024-11-21T10:31:40Z,2024-11-21T10:31:40Z,0,"This movie looks stupid, kraven doesnt even have special powers. They&#39;d be better off making another Winter Soldier adaptation."
@sebastianwolf7663,2024-11-21T09:19:30Z,2024-11-21T09:19:30Z,1,"Im honestly looking forward to this, looks like a fun popcorn movie"
@MDN891,2024-11-21T03:46:57Z,2024-11-21T03:46:57Z,0,Can&#39;t have a Kraven w/ out Spider Man....what&#39;s wrong w/ Marvel?  Like Venom w/ out Spidey....
@toorelevant364,2024-11-21T00:00:09Z,2024-11-21T00:00:09Z,0,The Flash has become the Kraven.
@SleepyAnt-oy8bl-w5j,2024-11-20T21:40:21Z,2024-11-20T21:40:21Z,0,As always: What&#39;s the story here? <br><br>As The Critical Drinker says: &quot;Ack - who even cares anymore 🤦?&quot;
@Barak_banana,2024-11-20T18:22:55Z,2024-11-20T18:22:55Z,0,В кажьдой сказьки есть правьда🤤
@ShivamGupta-sr9zf,2024-11-20T16:21:12Z,2024-11-20T16:21:12Z,0,Has the man come around yet?
@mirn3489,2024-11-20T09:03:49Z,2024-11-20T09:03:49Z,0,💨 💩
@paulweston8408,2024-11-20T00:50:34Z,2024-11-20T00:50:34Z,0,I&#39;m 99% sure I&#39;ve seen this entire movie during the multiple trailers over the past year or more!
@samuelhenkle574,2024-11-19T22:02:43Z,2024-11-19T22:02:43Z,0,"&quot;So that&#39;s it huh, we some kinda predators?&quot;"
@kevinatwell7212,2024-11-19T16:44:44Z,2024-11-19T16:44:44Z,0,We have Venom Vulture and Shocker Morbius
@demianpelos,2024-11-19T07:29:55Z,2024-11-19T07:29:55Z,1,So is a movie o lf a kod woth daddy issues? The bad guy is a dad? For spanking the oidnehen was a child???
@linkylin6982,2024-11-19T06:38:47Z,2024-11-19T06:38:47Z,0,This Christmas is about to get therapeutic
@HaydenSmith238,2024-11-19T06:20:17Z,2024-11-19T06:20:17Z,1,Rhino looks badass ngl. Im pumped!
@linkylin6982,2024-11-19T05:37:49Z,2024-11-19T05:37:49Z,0,This Christmas is about to get theaterpeutic
@chrisreinhart5472,2024-11-19T02:44:06Z,2024-11-19T02:44:06Z,1,Who asked for this just why
@Warlock-ke2sw,2024-11-18T23:18:11Z,2024-11-18T23:18:11Z,4,Does Sony stand or squat when they push out turds like this?
@Warlock-ke2sw,2024-11-18T23:16:06Z,2024-11-18T23:16:06Z,1,This looks like doodoo
@LuisGonzalez-uh3uu,2024-11-18T22:54:22Z,2024-11-18T22:54:22Z,0,Crossing my fingers this is semi decent
@miguelrodrigo3875,2024-11-18T14:16:37Z,2024-11-18T14:16:37Z,4,Either this guy or Tom Hardy should be James Bond!
@Da1Dez,2024-11-18T07:16:51Z,2024-11-18T07:16:51Z,0,"So Sony, you ready to be bought by Disney?"
@abhired3919,2024-11-17T16:42:18Z,2024-11-17T16:42:18Z,1,i think this is amazing spiderman universe
@bharatrajsinghchundawat2757,2024-11-17T11:49:57Z,2024-11-17T11:49:57Z,0,जोरदार
@bozhidarstavrev2645,2024-11-17T10:58:02Z,2024-11-17T10:58:02Z,1,&quot;It&#39;s Kraving time&quot; 🗣️🗣️
@zacksaulness,2024-11-17T07:53:42Z,2024-11-17T07:53:42Z,0,This is an Africa there should be a cameo of Wakanda
@alvindevasconcelos8555,2024-11-17T06:00:13Z,2024-11-17T06:00:13Z,0,People are actually if they don’t think this looks amazing
@kae6618,2024-11-17T05:07:35Z,2024-11-17T05:07:49Z,0,"<a href=""https://www.youtube.com/watch?v=I8gFw4-2RBM&amp;t=19"">00:19</a> LMFAOOOO"
@ttkktyty,2024-11-17T04:32:21Z,2024-11-17T04:32:21Z,0,"Considering kravin hunted Spiderman cause spiddy was the greatest prey and kravin killed him. Wtf kravin hunting? Hopefully this an orgins movie lots of potential if that is the case, honestly."
@duanestimolo1962,2024-11-17T03:41:46Z,2024-11-17T03:41:46Z,0,Finally looks like the real rhino not that armor bullshit
@MentLeee,2024-11-17T03:24:16Z,2024-11-17T03:24:16Z,0,These trailers won’t let these Johnny Cash songs rest
@Thereelt21,2024-11-17T02:19:08Z,2024-11-17T02:19:19Z,0,At this point just at least reference spidey in these movies
@imakethesites3048,2024-11-17T02:18:28Z,2024-11-17T02:18:28Z,1,So there won&#39;t EVER be Spider-Man in these spinoff films? What&#39;s their aversion to selling tickets? &quot;Spider-Man vs. Kraven&quot; would make enough money to offset the added cost of putting Spider-Man into it
@ELLISD_Wrks,2024-11-16T22:30:32Z,2024-11-16T22:30:32Z,0,So… what the fugg happened to JACKED superheroes/villains? Is Thor and Reacher(Amazon prime)it? In today’s Hollywood??<br>Or do they have to be CGI’d like the hulks(m&amp;f. I don’t see gender 👎🏿)are?
@ninthplxgue,2024-11-16T14:32:04Z,2024-11-16T14:32:04Z,1,Isn’t Russell Crowe Also Zues ??<br>Thors Love And Thunder…
@FrankCastle129,2024-11-16T14:27:41Z,2024-11-16T14:27:41Z,0,Well thats a first seeing someone get slapped in the face with a bear trap
@stepsis8437,2024-11-16T13:36:45Z,2024-11-16T13:36:45Z,0,It&#39;s good to that he&#39;s getting his own movie but i will never look at him the same after what Venom did 💀
@KaelynRobertson-dm3fz,2024-11-16T01:49:09Z,2024-11-16T01:49:09Z,1,"&quot;the hairs, on ur arm, will stand UP&quot; LMAO"
@justaracer_90,2024-11-16T01:12:15Z,2024-11-16T01:12:15Z,1,This looks awesome 🤯👏
@HerpaDurpVg,2024-11-16T00:33:28Z,2024-11-16T00:33:28Z,0,This actually looks better than I had expected it would
@rickyminjarez44,2024-11-15T20:05:36Z,2024-11-15T20:05:36Z,0,Rhino!!!
@I-R_kratos,2024-11-15T19:57:07Z,2024-11-15T19:57:07Z,0,Sweet! They just showed us every good part and the rest of the movie is going to be explanations and filler 😂😂😂
@andre-wx5kh,2024-11-15T17:48:15Z,2024-11-15T17:48:15Z,1,"Bro, forget, superhero fatigue. This is more like anti-hero fatigue at this point nobody wants to see these terrible antiheroes be introduced as good people. 😂 Just let them be selfish villains at the start penguin does a great job at this"
@sunyo6289,2024-11-15T06:46:10Z,2024-11-15T06:57:36Z,0,"Kraven,Venom and Morbius they go after  SPIDER-MAN Peter, Parker and Spider-Man the spider verse Miles Morales in MARVEL STUDIOS."
@DavidSustaita209,2024-11-15T00:56:03Z,2024-11-15T00:56:03Z,0,"Question are they using the real voice actor that voiced kraven from Spider-Man 2 ???? I’m just curious, cause they sound so alike."
@VADYCAN,2024-11-14T23:15:39Z,2024-11-14T23:15:39Z,0,My guide for whether to watch a new Marvel movie or not is if there&#39;s a Johnny cash song in it or not
@jessiewilson814,2024-11-14T18:01:19Z,2024-11-14T18:01:19Z,0,This movie definitely looks better than morbius.
@officerspooder,2024-11-13T21:50:12Z,2024-11-13T21:50:12Z,1,but you couldn’t make venom R???!
@EdjailMendes,2024-11-13T02:51:37Z,2024-11-13T02:51:37Z,0,🐲🫡🐲
@JonnyRoboto,2024-11-13T01:33:27Z,2024-11-13T01:33:27Z,2,Terrible trailer.
@Jb-mp1in,2024-11-12T03:58:54Z,2024-11-13T13:57:23Z,1,So is this the kraven and rhino that we&#39;re going to see with marvel  Spider-Man ?
@got2bluke,2024-11-11T21:29:11Z,2024-11-11T21:29:11Z,1,only spider man two fans know
@TeamLNE,2024-11-11T08:40:17Z,2024-11-11T08:40:17Z,33,"<a href=""https://www.youtube.com/watch?v=I8gFw4-2RBM&amp;t=53"">0:53</a> brutal!! 😳"
@hucklebuckchuck7218,2024-11-11T06:00:51Z,2024-11-11T06:00:51Z,0,I’ve never seen so much gore in a movie trailer
@Jurassisi,2024-11-11T03:56:07Z,2024-11-11T03:56:07Z,0,Rambo vibes
@AhyanShereef-i2o,2024-11-10T07:41:18Z,2024-11-10T07:41:18Z,0,Kraven.....SpiderMan 2.......
@sircal___4243,2024-11-10T06:44:29Z,2024-11-10T06:44:29Z,24,"<a href=""https://www.youtube.com/watch?v=I8gFw4-2RBM&amp;t=116"">1:56</a> The gun that gets handed to the guy in the passenger seat of the car is not even a real firearm. It’s a Tippman TipX. It’s a paintball marker that’s made to be magfed and used similarly to airsoft for stuff like woodsball or more military style games like airsoft usually is."
@deemoney1054,2024-11-10T02:58:30Z,2024-11-10T02:58:30Z,1,The Rhino🔥
@deemoney1054,2024-11-10T02:57:00Z,2024-11-10T02:57:00Z,0,Hell yeah!!!.....with Spiderman cameo......
@tezz907ontwitch,2024-11-09T09:31:16Z,2024-11-09T09:31:16Z,0,Cant be believe we got Rhino in a movie before GTA 6
@ManuelAlvarez-od1nb,2024-11-09T01:14:51Z,2024-11-09T01:14:51Z,0,Excited to see Rhino
@Hugh-Jassoul,2024-11-08T18:17:47Z,2024-11-08T18:17:47Z,0,So that’s where Bruno went during The Marvels?
@ericanthony1898,2024-11-08T10:40:50Z,2024-11-08T10:40:50Z,0,Patriarchy is back
@BronzeTiger-tc4rm,2024-11-08T06:49:45Z,2024-11-08T06:49:45Z,0,Can y&#39;all believe this is the guy from kick a$$
@His_Name_was_Cody,2024-11-07T14:25:14Z,2024-11-07T14:25:14Z,23,"Finally, Sony has the guts to release an R-rated movie. It looks gory and fun."
@justinnmai8903,2024-11-07T07:03:29Z,2024-11-07T07:03:29Z,0,God how many characters is Russel Crowe going to play in the mcu jesus Christ
@diesel8869,2024-11-07T03:12:42Z,2024-11-07T03:12:42Z,0,Unbelievable...how many positive comments about this trailer.<br>Times have changed <br>-an older man
@ethandiffey5799,2024-11-06T21:39:59Z,2024-11-06T21:39:59Z,0,Hello birthday movie
@camrenkimmerling9406,2024-11-06T16:22:17Z,2024-11-06T16:22:17Z,4,This movie is going to absolutely tank 😭
@Reathimus,2024-11-06T08:03:11Z,2024-11-06T08:03:11Z,2,"I really want this to be a good movie. I really do think there’s a lot of potential here for a good film and story from what we’ve seen in the trailers, regardless of Sony’s track record. I’m probably being too optimistic, but damnit I can’t help but feel that way."
@XSoulFire,2024-11-05T10:25:40Z,2024-11-05T10:25:40Z,3,"I feel like people are gonna hate this movie just like how they hated Morbius and Venom. People just hate the Spider-Man villain movies, even though they are so awesome."
@DiscoverDX,2024-11-05T09:54:58Z,2024-11-05T09:54:58Z,1,Check out the Kraven Coin KRV it&#39;s up nineteen percent!!!
@XSoulFire,2024-11-04T19:37:56Z,2024-11-04T19:37:56Z,32,This is the most badass trailer ever released in Marvel history
@andrewhastings6633,2024-11-03T19:49:46Z,2024-11-03T19:49:46Z,0,Kraven looks awesome! I wish all the Sony movies were like this. Instead of the BS Venom movies made for toddlers
@Ratty44t,2024-11-03T15:18:05Z,2024-11-03T15:18:05Z,0,"Please make Kraven a villain, not an anti hero"
@youngcastro917,2024-11-03T01:21:26Z,2024-11-03T01:21:26Z,0,Marvel doin bad rn like this looks like what they did to venom 🤦🏾‍♂️ and didn’t spider man beat the hell out both rhino and him why they fight at the end  then thunder bolt a fake suicide  squad and that was eh bc movies don’t follow comics no more shii wack
@WerxxxOutdoors,2024-11-02T21:18:38Z,2024-11-02T21:18:38Z,0,Is he the  end for spider man
@AntoineBiscuit,2024-11-02T10:40:41Z,2024-11-02T10:40:41Z,0,"After having been first introduced to Kraven the Hunter in Marvel&#39;s mobile game: Contest of Champions, where he is a well portrayed and dynamic champion, with crazy combos and special attacks, I am so excited to see what kind of character development they have in store for him for the movie."
@AnynomousBot,2024-11-01T21:50:04Z,2024-11-01T21:50:04Z,0,21m subs but 2.2m views flop marvel
@Lilbillookinself,2024-11-01T18:19:39Z,2024-11-01T18:19:39Z,0,This study looks tough
@carlosarriaga1035,2024-11-01T15:53:44Z,2024-11-01T15:53:44Z,0,This is de guy front  kit Kass movie
@Full_monty,2024-11-01T13:08:06Z,2024-11-01T13:08:06Z,0,Goo bad they made him into a antihero and not a crazy psychotic like in the comics
@TheAquaman22,2024-11-01T12:30:20Z,2024-11-01T12:30:20Z,0,Only 42 days to go!
@nullhare,2024-11-01T11:21:29Z,2024-11-01T11:21:29Z,0,"Yikes, I just watched Terrifier 3 and had a great time and YET!! This trailer was too violent for me!! CAN&#39;T WAIT!! Haha"
@ScarrJacobs,2024-11-01T07:20:39Z,2024-11-01T07:20:39Z,0,😮
@pat7036,2024-11-01T00:00:10Z,2024-11-01T00:00:10Z,0,Tangerine before meeting Lemon and Thomas the tank engine
@andrerosa6470,2024-10-31T19:53:25Z,2024-10-31T19:53:25Z,0,"I think that on this trailer, Kraven should be like Big Show but brawny.<br>And a little more old like a 40 or 50 years old."
@Robb-l5j,2024-10-31T18:34:42Z,2024-10-31T18:34:53Z,0,So you have a Kraven The Hunter movie for me?
@Mbizapplicant,2024-10-31T15:07:28Z,2024-10-31T15:07:28Z,0,When is it coming out?
@shahsahab6266,2024-10-31T07:31:06Z,2024-10-31T07:31:06Z,0,Strongest Enemy Of Spiderman
@WhATUpmAN301,2024-10-30T12:27:36Z,2024-10-30T12:27:36Z,2,I can&#39;t wait for this movie it looks so bad
@paulogo3482,2024-10-30T09:52:06Z,2024-10-30T09:52:06Z,2,Pfft.. It&#39;s Sony. I&#39;m out.
@Dabaddestbihfr,2024-10-30T05:54:43Z,2024-10-30T05:54:43Z,0,"Bro, wasnt he the quick silver quy? The speedster from Avengers Ultron"
@Kingdre48,2024-10-30T01:55:55Z,2024-10-30T01:55:55Z,3,Yall are in for a treat the story of KRAVEN is gonna blow your minds🔥🔥🔥🔥🔥🔥🔥🔥🔥🔥🔥
@haeunpark876,2024-10-29T04:21:09Z,2024-10-29T04:21:09Z,0,need that bad!!!
@Masterbaiter1000,2024-10-29T02:13:22Z,2024-10-29T02:13:22Z,1,Looks awful
@arthurmorgan5006,2024-10-28T23:26:01Z,2024-10-28T23:26:01Z,0,Granted it was a video game but still glasses isn’t venom and he doesn’t stand a chance against kraven
@Imanrez,2024-10-28T20:39:57Z,2024-10-28T20:39:57Z,5,It looks boring
@SebastianWeitz-f8y,2024-10-28T08:00:38Z,2024-10-28T08:00:38Z,1,is the man coming around?
@taylormitchell2119,2024-10-28T01:54:51Z,2024-10-28T01:54:51Z,0,This looks so bad. And why use the music from logan? That was iconic for that so this comes across as out of ideas and nostalgic in a way that has no connection 😂 marvel is grasping at straws and it&#39;s funny to watch 🍿
@jonnybarrera3355,2024-10-27T17:18:56Z,2024-10-27T17:18:56Z,1,When da man comes around 😏
@ElultimoFilm,2024-10-27T15:12:00Z,2024-10-27T15:12:00Z,0,where is spiderman?
@Glitchroguexp,2024-10-27T12:31:43Z,2024-10-27T12:31:43Z,1,Everytime someone likes my comment I&#39;ll watch the trailer again
@ivanhoe6897,2024-10-26T04:55:10Z,2024-10-26T04:55:10Z,1,"Kraven never kills human,they Always distorcono la finzione trasmutandola in realtà"
@mrrage690,2024-10-26T03:04:37Z,2024-10-26T03:04:37Z,2,Lesss go rated r
@tammycurious1877,2024-10-26T01:05:57Z,2024-10-26T01:05:57Z,1,"I have been waiting for over a year for this movie! What is the release date? Sony, you need to do better! Stop with the BS and release the movie already!"
@sherlockedambience8380,2024-10-25T20:41:14Z,2024-10-25T20:41:14Z,0,Where&#39;s spiderman
@mrbig813,2024-10-24T21:03:43Z,2024-10-24T21:03:43Z,2,looked good until i saw the awkwardly casted DEI hire
@Hypnotisingangel,2024-10-24T20:19:22Z,2024-10-24T20:19:22Z,3,"Venom, Venom: Let There Be Carnage, Morbius, Madame Web, Venom: The Last Dance, and now Kraven the Hunter. Sony are ruining these characters!"
@WatcherXel,2024-10-24T18:07:39Z,2024-10-24T18:08:03Z,17,"<a href=""https://www.youtube.com/watch?v=I8gFw4-2RBM&amp;t=20"">0:20</a> Secret “Tenet” reunion"
@gothicmetalmaniac7424,2024-10-24T15:55:15Z,2024-10-24T15:55:15Z,2,After seeing the trailer 4 this film i highly recommend this movie
@AdamT-88,2024-10-24T04:47:26Z,2024-10-24T04:47:26Z,1,I hate how Kravens dad sounds more like Kraven then Kraven.
@moneystackx2016,2024-10-24T01:52:41Z,2024-10-24T01:52:41Z,0,"When is this movie droppin, can&#39;t wait to see it."
@JRAnimations,2024-10-23T22:15:58Z,2024-10-23T22:15:58Z,1,Ahh Classic Sony. Spoiling things in your movie that won’t make it any better. 👏🏽
@SteevensonSaintLaurent,2024-10-23T16:16:30Z,2024-10-23T16:16:30Z,0,Nice movie
@yukijadenfilms3425,2024-10-22T19:14:32Z,2024-10-22T19:14:32Z,8,"<a href=""https://www.youtube.com/watch?v=I8gFw4-2RBM&amp;t=130"">2:10</a> he’s gonna become a wetsuit? 🤨 WHEN THE MAN COMES AROUND"
@tanjim.researcher,2024-10-22T04:04:29Z,2024-10-22T04:04:29Z,0,Wanda is waiting to meet her brother 😅
@davidgunn4316,2024-10-21T18:43:32Z,2024-10-21T18:43:32Z,0,cool...but they made kraven a good guy?...he was spiderman&#39;s enemy in the comics...oh well
@KaceyFord-m9q,2024-10-21T16:02:47Z,2024-10-21T16:02:47Z,0,🔥🔥🔥🔥🔥😮
@baxatakbaxatak2014,2024-10-21T14:44:42Z,2024-10-21T14:44:42Z,0,"An American accent for Sergei Kravenoff. What a joke. Couldn’t cast Richard Armitage or Gerard Butler, had to go with a retread. This is going to suck."
@cashprinter5000,2024-10-21T02:51:49Z,2024-10-21T02:51:49Z,0,So this is what prime mr ditkovich looks like....
@Quaaludio,2024-10-20T22:54:02Z,2024-10-20T22:54:02Z,0,Cant wait for him to &quot;become wegend&quot;
@VishinSingh,2024-10-18T18:13:06Z,2024-10-18T18:13:06Z,0,"I just realized, both ATJ and Evan Peter&#39;s did return in the MCU, but they didn&#39;t returned as Quicksilver even tho there was a reference of Quicksilver in DP&amp;W 💀"
@imrpig,2024-10-18T17:30:41Z,2024-10-18T17:30:41Z,1,so many good movies this year and next year
@ianland8474,2024-10-18T14:44:40Z,2024-10-18T14:44:40Z,0,I think it would be so cool if they get the sinister six together in this world and then set up tom holland spiderman to get booted to this world by america chavez with her portal so he had no choice but to be stuck in a NYC with the sinister six and no back up. 😂
@Drushy_G,2024-10-17T23:27:38Z,2024-10-17T23:27:38Z,0,Marvel getting crazy with the gore
@Кристина-л2я4ч,2024-10-17T15:06:51Z,2024-10-17T15:06:51Z,0,Надо глянуть обязательно
@the-lego-show,2024-10-16T20:29:54Z,2024-10-16T20:29:54Z,0,Is it bad that the first thing I thought of was Spiderman ps5 2 movie version
@Sin_Of_Greed,2024-10-16T20:06:28Z,2024-10-16T20:06:28Z,0,"Great... So you stole the plot from Red Notice, and added some R -rated violence to it.<br>(joking, obviously)<br>Still, having the main character escape an icy fortress, wearing the exact copy of the jumpsuit from Red Notice, then going on a Jungle Cruise, adds up just too many similarities."
@Sin_Of_Greed,2024-10-16T19:56:05Z,2024-10-16T19:56:05Z,0,"Glad to see more of Marvel R -rated stuff. Big fan of Aaron Taylor-Johnson. I just hope he doesn&#39;t go &quot;Kravin&quot; too hard, internet can&#39;t handle it..."
@chantalj.5217,2024-10-16T19:07:55Z,2024-10-16T19:09:58Z,3,I like the lead actor..He was great in bullet train...He would play a great rock star too..<br>This movie has everything in it..The fighting; appears modern..yet also sci-fi ..<br>I love it when they do a cool move in a movie...I can’t wait to see what they come up with for this one..😊
@TheLaughingLibrarianBookLife,2024-10-15T22:06:10Z,2024-10-15T22:06:10Z,1,Another morbius movie?
@sunsetzandvoort,2024-10-14T19:39:02Z,2024-10-14T19:39:02Z,0,Please gib..Kraven vs Morbius vs Madam web
@Colessolovids,2024-10-14T15:41:30Z,2024-10-14T15:41:30Z,1,W
@Sin1one,2024-10-13T15:07:17Z,2024-10-13T15:07:17Z,1,Generic AF
@DavidKirlewMorris,2024-10-13T15:03:03Z,2024-10-13T15:03:03Z,0,It&#39;s kravin&#39; time
@nils5898,2024-10-12T09:32:52Z,2024-10-12T09:32:52Z,1,Will Kraven teaming up with Scorpion?
@JoanAaron-i1s,2024-10-11T12:33:34Z,2024-10-11T12:33:34Z,0,Casandra Parkways
@keymail21,2024-10-11T03:55:04Z,2024-10-11T03:55:04Z,2,"Congrats to Aaron Taylor-Johnson for &quot;The Most Handsome Man in the World&quot;, according to the Greek Golden Ratio of Beauty.👏👏👏"
@donttrustme1201,2024-10-11T00:43:25Z,2024-10-11T00:43:25Z,0,They did a pretty good job in the ps5 spider man 2 game....but i don&#39;t know if this will work or not
@armaaka8,2024-10-10T14:16:16Z,2024-10-10T14:16:16Z,0,me leaving the theater after kraven smirks and says &quot;It&#39;s kraving time!!&quot;
@AriaRavenlock,2024-10-10T09:57:01Z,2024-10-10T09:57:01Z,1,"They&#39;re really going for the antihero Kraven, aren&#39;t they?"
@MarcusDoucett,2024-10-09T17:35:12Z,2024-10-09T17:35:12Z,0,It’s time to finish collecting new spider-man’s Universe movie next year
@joemyoya,2024-10-09T12:55:34Z,2024-10-09T12:55:34Z,1,"With great horns, comes great horniness. Lets connect."
@mootje34A,2024-10-08T14:32:16Z,2024-10-08T14:32:16Z,0,Kraven the hunter in the lion king pfffff 🔥🔥🔥🔥fight against Simba 🔥🔥🔥🔥🔥grazy wil that be
@Pheonix_32,2024-10-08T02:41:22Z,2024-10-08T02:41:22Z,85,absolutly loved it when kraven said its kravenin time and kravened all over the place truly a masterpiece
@sylbaster2658,2024-10-06T20:12:00Z,2024-10-06T20:12:52Z,1,"He was always my favorite Marvel character in the comics, and TBH, I&#39;ve kind of been really disappointed in how Marvel has done most of their movies, so I just stopped watching them a while back. But I&#39;ll go see this one."
@Maryam.Offical,2024-10-06T20:07:18Z,2024-10-06T20:07:18Z,1,When the man comes around ;)
@azel8rrp169,2024-10-06T06:30:30Z,2024-10-06T06:30:30Z,1,"I like this guy as an actor, but I don&#39;t see this movie being any good."
@Saitamabutreallybald,2024-10-06T03:52:08Z,2024-10-06T03:52:08Z,0,"We have to see spider man vs kraven<br>And Deadpool vs kraven <a href=""https://www.youtube.com/watch?v=I8gFw4-2RBM&amp;t=84"">1:24</a>"
@itsokayluv7342,2024-10-05T17:54:49Z,2024-10-05T17:54:49Z,0,"Make a Indian hero most of your fans are from here you guys make so much money from our country and have made characters for all countries expect india, every kid from the tender ages to an adult watches marvel here, don’t break our hearts"
@CERTIFIEDBABEWRANGLER,2024-10-04T20:37:41Z,2024-10-04T20:37:41Z,0,I forgot this existed lmao
@Cristo_Charmed,2024-10-03T13:34:21Z,2024-10-03T13:34:21Z,0,WHEN THE MAN COMES AROUND
@ekeminibob3539,2024-10-03T02:37:29Z,2024-10-03T02:37:29Z,1,When the man comes around Madame goes around 😢
@videogamelover2006,2024-10-01T17:56:48Z,2024-10-01T17:56:48Z,1,I think this movie looks great. I love that. When the man comes around by Johnny Cash is in the trailer.
@EvanJackson-ss8br,2024-10-01T04:25:46Z,2024-10-01T04:25:46Z,0,Hate they won’t let him in the mcu tho
@stivwhat,2024-10-01T02:24:50Z,2024-10-01T02:24:50Z,1,"He don’t look like Kraven, more like Antonio"
@Dan-uu1ys,2024-09-30T23:19:56Z,2024-09-30T23:19:56Z,5,Kraven the Hunter have always been one of my all-time favorite  Spider-Man villain&#39;s.. man I hope this movie turns out to be good!!
@craftymojo5882,2024-09-30T21:39:28Z,2024-09-30T21:39:28Z,2,"I am loving Kraven&#39;s intensity. I just hope they keep the fact he is a trained hunter. You can be a proud hunter and have respect for the animal kingdom all the same. Sure, its alittle morally grey but that is Kraven. In the comics he has tended to and protected a animal. In fact he&#39;s utterly horrified seeing a hornless rhino nearlly killed by poachers.<br><br>All in all while he respects animals and loves them in a twisted way, he still wants to be the apex predator in both food chains so i hope they can find that balance."
@mysticalkeyblade759,2024-09-30T17:52:39Z,2024-09-30T17:52:39Z,0,Can’t be worst than Morbius
@mayafox7001,2024-09-30T05:08:24Z,2024-09-30T05:08:24Z,0,I know
@SuperOveride,2024-09-30T00:25:10Z,2024-09-30T00:25:10Z,0,"I think it&#39;s ironic that the only mentor Kraven had was his own father, the villain of the film."
@joestarhiroshi9576,2024-09-29T10:19:09Z,2024-09-29T10:19:09Z,0,It’s morbin time
@anomalyevolution40,2024-09-29T05:31:10Z,2024-09-29T05:31:10Z,0,&quot;When a man comes around.&quot; I just wanted you guys to hear it one more time.
@Darrylp-m1u,2024-09-29T02:49:32Z,2024-09-29T02:49:32Z,2,It Giving me Tarzan vibes 🔥
@echo.echo08,2024-09-28T10:57:46Z,2024-09-28T10:57:46Z,0,i just recently watched Shanghai Knights and i can&#39;t believe this beast is the very same boy who played the street rat
@jonanaokar2244,2024-09-27T22:08:03Z,2024-09-27T22:08:03Z,3,"What&#39;s the point of watching a movie with a spiderman villain, without spiderman?"
@KeraAlexis,2024-09-27T19:09:53Z,2024-09-27T19:09:53Z,0,Where can i watch this
@Slossbrian3,2024-09-27T18:36:12Z,2024-09-27T18:36:33Z,1,This movie say he’s the enemy of Spider-Man he said he turned into lion and first Spider-Man
@fullerwalter739,2024-09-27T09:01:04Z,2024-09-27T09:01:04Z,0,0169 Flavie Spurs
@xashfordx,2024-09-25T22:52:58Z,2024-09-25T22:52:58Z,1,Flop
@ntrly_oliver,2024-09-24T07:50:08Z,2024-09-24T07:50:08Z,0,Kraven Wick before gta 6 is crazy
@JavenVirtudes,2024-09-24T06:02:54Z,2024-09-24T06:02:54Z,0,Kraven dodging more bullets than Quicksilver ❌<br>Kraven blocking more bullets than Deadpool ✅
@zulfuqarnasirli8681,2024-09-23T16:43:24Z,2024-09-23T16:43:24Z,0,Каждий сикаски йист правда. 😂😂😂😂😂
@Swagger1328,2024-09-23T16:40:45Z,2024-10-26T11:42:22Z,0,"<a href=""https://www.youtube.com/watch?v=I8gFw4-2RBM&amp;t=115"">1:55</a> <a href=""https://www.youtube.com/watch?v=I8gFw4-2RBM&amp;t=124"">2:04</a> <a href=""https://www.youtube.com/watch?v=I8gFw4-2RBM&amp;t=126"">2:06</a> <a href=""https://www.youtube.com/watch?v=I8gFw4-2RBM&amp;t=128"">2:08</a> <a href=""https://www.youtube.com/watch?v=I8gFw4-2RBM&amp;t=137"">2:17</a>"
@HolyFacts,2024-09-23T08:53:57Z,2024-09-23T08:53:57Z,1,IVANNA KRAVE ALOT.
@HolyFacts,2024-09-23T08:51:55Z,2024-09-23T08:51:55Z,1,"Total build up for, &quot; KRAVEN, THE ULTIMATE TRAP, FOR JOHN WICK. &quot;"
@markellsimmons4831,2024-09-22T13:09:01Z,2024-09-22T13:09:01Z,0,I love Kraven.he is just like shaggy rogers. Because they both have so much power.❤
@jacobpalitsky32,2024-09-22T09:26:36Z,2024-09-22T09:26:36Z,1,"Kraven is one of my favourite spider man villains. Solely relying on his skills, instincts, hunting prowess….god so awesome"
@milindvaidya433,2024-09-21T19:39:36Z,2024-09-21T19:39:36Z,1,The Spectacular Spider-Man: Miles Morales ( December 2028)
@MarkTrombone,2024-09-21T19:37:56Z,2024-09-21T19:37:56Z,2,Dont know why ppl in the comments are being so hard on this trailer?? This movie looks badass
@SophiaBlanche-y4v,2024-09-21T00:59:39Z,2024-09-21T00:59:39Z,0,395 Kunde Crescent
@WayneKeeley-do3zi,2024-09-21T00:18:39Z,2024-09-21T00:18:39Z,0,When&#39;s this out please
@rise5558,2024-09-20T22:31:54Z,2024-09-20T22:31:54Z,0,Yeaaaaaahhhh mfz! RISE!!
@JalenRoberson-b8z,2024-09-20T20:40:23Z,2024-09-20T20:40:23Z,0,Now this looks promising
